business_id;name;rating;review_count;category;lat;lon;address;phone;category_source
IRwXxLUE1lW9OvZXGcW6Sg;Holiday Inn Express & Suites Edmonton North;15;6;Hotels & Travel, Venues & Event Spaces, Hotels, Event Planning & Services;535984318;-1134159079;13742 50th St;;hotels
zGzysVR5zItS7mbJsZfS1A;Cafe Del Sol;40;25;Mexican, Restaurants;53592326;-113441408;6502 132 Avenue;;restaurants
ivmUyL6s8rKkNn0oqjoylg;Wendy's;15;8;Burgers, Restaurants, Fast Food;5,35933E+11;-1,13416E+11;13138 50th Street;;restaurants
t_kaF5fKdOunMUg1_Zq08Q;Bench;30;5;Men's Clothing, Shopping, Fashion, Women's Clothing;534855183;-1135137822;Southgate Shopping Centre, 5015 111 NW St;;shopping
G6nWcJom3gMOZyEDm5YfFA;showdown tattoo;40;11;Sporting Goods, Shopping, Piercing, Skate Shops, Beauty & Spas, Tattoo;535504715;-1134883758;10601 97 street;;shopping
ZXnoFqR62crtdu4s56egyA;Good Buddy Restaurant;30;46;Restaurants, Chinese;5359774357;-1,13491E+12;Northgate Mall, 1018-9499 137 Avenue NW;;restaurants
f13P9cscozrAshoi6EehMw;Blue Nile;35;5;Ethiopian, Restaurants;535512737;-1135115313;11019 107 Avenue NW;;restaurants
m7kkotVaWGTntsfroZaX0A;Boston Pizza;40;9;Italian, Pizza, Restaurants;535456285;-1134946715;10111 104 Avenue, Unit 120;;restaurants
jGxP-kH2rz1UyQB2OJi9rg;Rafters Home Store;25;16;Shopping, Home & Garden, Home Decor;534490312;-1134838198;1949 98th Street;;shopping
RhlgiBhUzYM-J_oFgicBEw;The Horses at Northlands Park;30;12;Horse Boarding, Horse Racing, Arts & Entertainment, Active Life, Pets;535644839;-1134572611;7410 Borden Park Road;;arts
3tCceP6OJT9anbOhjGVuIg;Gogo Lounge;40;6;Nightlife, Lounges, Bars;535443243;-1135360923;10240 124 Street NE, Suite 56;;bars
DkVJN6fTmUM9XxVP0Sp_tA;Edo Japan;30;8;Restaurants, Japanese;5,3523E+11;-1,1362E+12;8882 - 170 Street;;restaurants
F2e_n_3JUPXNq3sHiduRbA;Filistix;40;12;Specialty Food, Food, Ethnic Food, Food Stands, Imported Food, Restaurants, Street Vendors;535461245;-1134938229;;;restaurants
gaBqXU8ipANuXDjogoCAag;Whistling Kettle Cafe;40;12;Coffee & Tea, Food, Breakfast & Brunch, Restaurants;535914606;-1134178452;13022 50 Street NW;;restaurants
5u4nzV_Vpy6ubFM6FXqBNw;Delux Burger Bar;35;76;Food, Burgers, Specialty Food, Restaurants;535344063;-1135663499;9682 142 St NW;;restaurants
Ccwl5QFSZIbEX4HPt4Z9rA;Williams-Sonoma;40;10;Home & Garden, Kitchen & Bath, Shopping, Appliances;5,35228E+11;-1,13621E+12;8882 170 Street NW;;shopping
rKoWJaR8X22XyM2hVsQNOA;X-L Furniture;40;6;Home & Garden, Furniture Stores, Shopping;535638619;-1134868246;11349 95 Street NW;;shopping
3vzsNEFENf7HyyvdrOBAjQ;Nomad Kitchen;45;5;Restaurants, Food Trucks, Food Stands, Food, Diners;535409896;-113495577;102 St and Jasper Avenue;;restaurants
PVbOpU62LgBIJo0noXhcZA;Montana's BBQ & Bar;25;39;Canadian (New), Restaurants, Steakhouses, Comfort Food, American (Traditional), American (New);534464664;-113485541;1720 99 St Nw;;restaurants
TwrhXn4Xqt6MCLWnEdUDaA;Bingo Pizza Pasta & Donair;50;5;Donairs, Restaurants, Food, Pizza;535894418;-1134913719;12965 97 Street NW;;restaurants
GPe-7Tvr_of8-JirusJ6hw;Boston Pizza;25;48;Restaurants, Pizza, Italian;535412523;-1135034565;10620 Jasper Avenue NW;;restaurants
DKcFxSfjLvSXRB9rOKE8jw;KFC;15;9;Fast Food, Mexican, Restaurants, American (Traditional), Chicken Shop, Chicken Wings;5,34254E+11;-1134766196;9260 Ellerslie Road SW;;restaurants
ThW0hRlbl-D7aou_89Aaqg;Pro Skate;45;6;Sports Wear, Sporting Goods, Shopping, Hockey Equipment, Skate Shops, Fashion;534886664;-1134691513;9212 51 Avenue NW;;shopping
KGjjwjlbj8zO_EAf7KiHXA;Marshalls;30;5;Fashion, Shopping, Department Stores;53450646;-113484324;2039 - 98th Street NW, SOUTH EDMONTON COMMON;;shopping
UioH-rT6KHrD15kVVE7Cjw;Wetzel Pretzel;35;19;Desserts, Food, Fast Food, Restaurants, Bakeries;535241774;-1136152089;8881 170 St, Ste 1755;;restaurants
s1GeZSSotcqGjVQequ8EPw;Tim Hortons;30;5;Restaurants, Canadian (New);534737753;-1134495363;7535 38 Ave NW;;restaurants
XUV5N59OnhLsg5z3PHx1eg;Il Forno Ristorante;30;24;Restaurants, Italian, Pizza;535395491;-1135786982;14981 Stony Plain Rd NW;;restaurants
xg-fzn4JEvGl9S9D6-9dsA;Auto Imports;40;5;Automotive, Auto Parts & Supplies, Auto Repair, Tires;53511692;-1134864884;9904 75 Avenue NW;;arts
hiRFCVIrbFs1DjHD0_ktvg;Pizza Hut;35;6;Restaurants, Pizza, Food, Chicken Wings, Italian, Food Delivery Services;5,35205E+11;-1,13593E+12;156 Street and 87 Avenue NW, Unit 260;;restaurants
wvqIG-nWucD9ML2Pt7BdVQ;Lan Phu Thai;50;8;Restaurants, Thai;53592436;-113441733;6502 132 Avenue NW;;restaurants
afkw4ZMsFhMyWpYn5xHCYg;The Tea Place;40;34;Coffee & Tea, Restaurants, Sandwiches, Food;53598061;-113572949;13671 Street Albert Trail NW;;restaurants
NF5ovoApBMIMomUyp2YfWQ;GTFO Escape Entertainment;50;32;Challenge Courses, Arts & Entertainment, Active Life, Escape Games;535394481;-1135013724;10018 105 Street, 2nd Floor;;arts
EruEoNu4v03gBlNVMWNALw;Rundle Park;40;13;Parks, Boating, Tennis, Active Life, Mini Golf;53555004389;-1,13388E+12;2909 113 Avenue NW;;parks
GcGXcAz736wCPx2axOnvYA;Value Village;30;21;Thrift Stores, Used, Vintage & Consignment, Local Services, Community Service/Non-Profit, Fashion, Shopping;5,34667E+11;-1,13488E+12;10127 - 34th Ave NW;;shopping
EeMQfoJgl8Xtyew6AXzcyg;H2O Lounge;20;19;Sports Bars, Karaoke, Nightlife, Bars, Lounges;535184082;-113490212;10044 82 Avenue Northwest;;bars
X2x1rHRYNayXZ-BN4CGGRQ;Jugo Juice;30;5;Food, Juice Bars & Smoothies;5,35436E+11;-1,13494E+12;Edmonton City Centre, 10025 102A Avenue;;bars
-5ivHc7R7F_fHxTtxGvlgA;Mt Fuji Teppanyaki;35;23;Restaurants, Japanese;53600886;-113495432;102-9940 137 Avenue;;restaurants
oBmkr9cUmwOBA4hLi3-U-w;Good Buddy Chinese Restaurant;25;67;Restaurants, Chinese;534526562;-1135137517;2059 111 Street NW;;restaurants
7i39pzQfXiJzJdLEo-BZRA;Mike's Sub and Donair;35;5;Fast Food, Restaurants;535453888;-1136123809;358 Mayfield Common NW;;restaurants
stSD7zDVWDrurFYpL2Y9Sg;Saigon Taste;40;36;Vegetarian, Chinese, Restaurants, Hot Pot, Vietnamese;5,35459E+11;-1,13513E+12;10383 112 Street NW;;restaurants
Zyp9DZ_l7vyfKwTOUmxSvw;Little Caesars Pizza;20;8;Restaurants, Pizza;53546591;-1135195355;11588 104 Avenue NW;;restaurants
bonyK-iuhyybLJc62NYSMw;SEPHORA;35;19;Beauty & Spas, Shopping, Cosmetics & Beauty Supply;5,35627E+11;-1,13506E+12;109 St. & Princess Elizabeth Ave., Suite 200;;shopping
e0iCFeakO_y2Jwjm8stW8w;Taste of Szechuan;45;12;Chinese, Szechuan, Restaurants, Hot Pot;534732234;-1134852708;3855 99 Street NW;;restaurants
AWcvXiZyxdDlj_ImZh896w;South Edmonton Common;25;19;Cinema, Shopping, Shopping Centers, Arts & Entertainment;53446977;-1134813523;1978 - 99 Street NW;;shopping
Fq5gQHtwiRx-vgxbG_dlRw;Red Lobster;25;70;Restaurants, Seafood, American (Traditional);535417697;-1,13616E+12;10111 171st Street;;restaurants
i4CE5oDN58ieUtwffub-RQ;Galaxyland;35;38;Amusement Parks, Active Life;53523746027;-1,13621E+12;8882 170 Street NW;;parks
SN6oCdu9zGamDQj5041Xyg;Ricki's;45;8;Accessories, Fashion, Women's Clothing, Shopping;53522535;-113624213;8882 170 St NW;;shopping
YfAS0B4s9Wk_lcE-dEQiJg;A Yah Mi Deh Jamaican Restaurant;45;21;Ethnic Food, Food, Restaurants, Specialty Food, Caribbean;535703437;-1134113295;4435-118 Avenue;;restaurants
C6viAwGwbbzDazD5IBM2ZQ;Boston Pizza;30;17;Pubs, Restaurants, Bars, Pizza, Nightlife;5362967;-1,13544E+12;12788-167 Ave Edmonton;;restaurants
_8igh2mxuHZTOnm0k2MT_Q;Why Not? Cafe And Bar;45;13;Bars, Seafood, Restaurants, Cafes, Nightlife;535216581;-1135122992;8534 109 Street NW;;restaurants
xHy5jRSjd1K1H48bJHNd3A;The North Face;40;5;Women's Clothing, Sports Wear, Men's Clothing, Shopping, Fashion, Outdoor Gear, Sporting Goods;53522752;-113624769;8882 - 170 Street, Space R219;;shopping
3iNJRKN3Nx9MmBpNfXfVDQ;Extreme Pita;30;6;Restaurants, Mediterranean, Sandwiches, Fast Food;535406247;-113641641;18483 Stony Plain Road NW;;restaurants
tZxhg6paYPUKA5blNBgxAA;Delica Bridal;50;15;Bridal, Shopping, Fashion, Women's Clothing;5,34292E+11;-1,1348E+12;2951 Ellwood Drive, Suite 108;;shopping
qLybIj71KtbvpvHza93HpA;MacBeth Comics and Collectibles;45;6;Comic Books, Books, Mags, Music & Video, Toy Stores, Shopping;535514622;-1135353819;10715 124 Street NW, Suite 101;;shopping
FM81cYp1irTPZTKD-bXWzw;Sunbake Pita Bakery;45;63;Middle Eastern, Pizza, Bakeries, Food, Lebanese, Restaurants, Halal;535952957;-1135063065;10728 134 Ave NW;;restaurants
Wln_3egrGnPQagNrdAVH7A;Rigoletto's Cafe;40;32;Italian, Restaurants;535385316;-1134979168;10305 - 100 Avenue NW;;restaurants
f9_TLVlUHBv0869CygEbZg;Dadeo;40;237;Restaurants, Southern, Cajun/Creole;535184085;-1135026666;10548A 82 Avenue NW;;restaurants
UuWMujQCE_5HGfxL7wdx2A;Mark's;30;5;Fashion, Shopping, Men's Clothing, Women's Clothing, Accessories;535630285;-1135540588;620 1100 Westmount Shopping Centre NW;;shopping
wCeVZcCMuflmgzjFrPiYPQ;Rexall;35;8;Pharmacy, Shopping, Drugstores, Health & Medical;535406643;-1135256538;11811 Jasper Avenue NW;;shopping
-RS_7SU42foCTItx4f3C6A;Subway;30;8;Sandwiches, Restaurants, Fast Food;535214101;-1135203104;Newton Place University of Alberta, 8511 112th St;;restaurants
NIb3KBSmm4FivxoerbkwEA;Prairie Noodle Shop;35;112;Local Flavor, Asian Fusion, Ramen, Restaurants, Japanese, Noodles;53545974;-113536213;10350 124 Street NW;;restaurants
VVpQU10_dhKkFz8eBAFQUg;Sorrentino's South;35;31;Restaurants, Nightlife, Pizza, Italian, Bars, Lounges;534782539;-1134958999;4208 Calgary Trail NW;;restaurants
4c6KFQDT51uHrPcfoXUfeg;Spotlight Cabaret;45;12;Arts & Entertainment, Cabaret, Music Venues, Nightlife, Restaurants, Gastropubs;53518453;-113497289;8217 104 Street;;restaurants
TbzemmCvd6vB7nbMEa1QlQ;Wing Chicx;40;61;Chinese, Korean, Restaurants;53429936;-113478305;2912 Ellwood Drive SW, Unit 28;;restaurants
9unJwFyCX15zPuZDIuKxtg;Dream Donair & Pizza;40;18;American (Traditional), Greek, Burgers, Arabic, Restaurants, Donairs, Food, Pizza;5349902;-1134863145;6230 99 Street;;restaurants
29en4KwCiCj5NjSu3XyaIg;Simons;40;34;Women's Clothing, Home Decor, Department Stores, Shopping, Fashion, Home & Garden, Accessories, Men's Clothing;5,35235E+11;-1,13628E+12;8882 170 Street NW, Unit 2401;;shopping
xCr6jmZz2_yOzwAMjEvxhg;Crazy/Beautiful Hair Studio;35;14;Hair Salons, Cosmetics & Beauty Supply, Beauty & Spas, Makeup Artists, Shopping;534963147;-1134706456;;;shopping
r0NkWsutE4b8ONlJhoMXWg;Astros Restaurant;40;11;Steakhouses, American (Traditional), Restaurants, Pizza;53540525;-113609318;10038 167 St NW;;restaurants
WBI4wpop4Ox0y5lg4GvhnQ;Saigon Cuisine;35;23;Restaurants, Vietnamese;5,34677E+11;-1,13587E+12;508 Riverbend Square;;restaurants
rKuhseqemnbSsBT-4_g7PQ;Red Loon;50;6;Tattoo, Beauty & Spas, Fashion, Piercing, Jewelry, Accessories, Shopping;535138187;-1134979425;7716 104th Street;;shopping
8oMrFwKdxey0ICvpaqRGKQ;Sundance Mazda;35;16;Automotive, Car Dealers, Auto Repair, Auto Parts & Supplies;535438193;-1136321966;17990 102 Avenue NW;;arts
2QIxk_gGB9rRX45uzmPHuA;Remedy;50;10;Restaurants, Food, Coffee & Tea, Cafes, Breakfast & Brunch;5,35179E+11;-1,135E+12;8155 105 Street;;restaurants
U-fs6PO3Sg3xKGi9Wqzbkw;Liuyishou Hotpot Edmonton;40;7;Hot Pot, Restaurants, Chinese;53549162;-1134886588;9700 105 Ave NW, Suite 168;;restaurants
i9zqoiryCTHbcoUv-c4m9Q;Korean Grill;40;5;Restaurants, Korean;534298813;-1134782617;2912 Ellwood Dr SW, Unit 28;;restaurants
wf9IqrwI8Vj57U-ABuZ9Dw;NYF;35;10;Restaurants, Fast Food;53522447;-113621873;8882-170th Street;;restaurants
VZ9xnsYuFhuJ5excEHazbQ;Northlands;30;47;Arts & Entertainment, Music Venues, Stadiums & Arenas, Nightlife;535683348;-1134564218;7515 118 Avenue NW;;nightlife
zs9-Hyc7ZlkFu5uAN46IdA;John Janzen Nature Centre;45;7;Museums, Arts & Entertainment, Parks, Active Life;5,35025E+11;-1,13572E+12;7000-143 Street;;museums
FmNJnhYMzPUaCjtqKwgB8Q;SABBS Restaurant & Lounge;45;5;Bars, Lounges, Nightlife, American (Traditional), Restaurants, Mediterranean;535479316;-1134939271;10508 101st Street NW;;restaurants
S6HhMZgDpAdpArUKRlrSrw;Japonais Bistro;40;142;Sushi Bars, Japanese, Restaurants;53541294;-1135254643;11806 Jasper Avenue;;restaurants
bNIL04bBGKcfBTj0Rnrj_g;Kai Asian Grill;30;6;Restaurants, Asian Fusion;5354077;-11350881;10909 Jasper Avenue, Unit 100;;restaurants
t0kdYZvEy78RHUD7nq2yAw;Saccomanno Bros;40;21;Italian, Restaurants, Pizza;53585089;-113495987;10208 - 127 Avenue;;restaurants
Ivda64EJHZVQa1hBBRJumg;Pizza 73;20;5;Restaurants, Pizza;535370338;-113438232;9722 Ottewell Rd;;restaurants
vMI9XcEWs9aE7hN0yK6GLw;Papyrus;35;8;Arts & Crafts, Flowers & Gifts, Cards & Stationery, Event Planning & Services, Shopping;53487049;-113513504;Southgate Mall, 5015 111st;;shopping
doXrSxu1hoYiQNlmyWS5yw;Dessert Island;40;5;Restaurants, Desserts, Food, Chinese, Coffee & Tea;535539179;-1134904704;10824 - 97 Street NW;;restaurants
WN26x54OVTnTrRFLvjKG4Q;Healthcare Solutions;35;5;Physical Therapy, Medical Centers, Home Health Care, Health & Medical, Shopping, Medical Supplies, Fitness/Exercise Equipment;53598271;-113487625;9499 137th Avenue NW;;shopping
wDV-rdks_6O-jBkKhzThBQ;Hart's Table & Bar;35;102;Restaurants, Canadian (New);534538434;-1135665852;14229 23 Avenue;;restaurants
b3KxHgc7le1Mc2Q3OFsszw;Flowers By Merle;35;16;Flowers & Gifts, Shopping, Florists;535479541;-1135352377;12320 105th Ave NW;;shopping
exWa73g8bG0p3pI7NlKD8Q;Careit Urban Deli;40;18;Restaurants, Delis, Specialty Food, Food;5,35346E+11;-1,13566E+12;Crestwood Centre, 9672-142 Street;;restaurants
5sK3TA26u-XLtkXPsZk9ew;Union Hall;25;28;Arts & Entertainment, Dance Clubs, Music Venues, Nightlife;534986139;-1134874713;6240 99 Street NW;;nightlife
TBmOpMQfWJy3v3b713X6wQ;Chianti Cafe & Restaraunt;35;36;Cafes, Italian, Restaurants;535986225;-1134037205;13712 40th street;;restaurants
mu2GzX8oFI78IuhbzkOECQ;Y Not Indian;40;21;Restaurants, Indian, Vegetarian, Vegan;53517943745;-1,13496E+12;10331 82 Avenue NW;;restaurants
nmtJg8-NaWekTnCfRp9u0A;Mill Creek Ravine Park;45;9;Parks, Dog Parks, Active Life;53512554;-113472905;76 Ave NW & 96 Street NW;;parks
Fw0Zj62lkz-KUPu-RgJRrA;Ninh Kieu Restaurant;35;5;Vietnamese, Restaurants;535517675;-113490943;10708 98 St NW;;restaurants
RwNRZ_8O0p2dam52_fZPXA;Ceili's Irish Pub;35;11;Bars, Pubs, Nightlife;535460843;-1135100196;10338 109 St NW;;bars
hS0QiAXPyf3GcLu8nw1hAQ;The Chopped Leaf;35;35;Salad, Sandwiches, Restaurants, Soup;535418167;-1134947379;10155 102 St, Ste 148;;restaurants
o1-UIT87_Usm3A6hneFfoQ;The Bower;40;12;Bars, Nightlife, Cocktail Bars, Dance Clubs, Lounges;53541361;-113502114;10538 Jasper Avenue;;bars
Z3xscDO1sMReiVfg5pnn7w;Hudsons Canada's Pub;35;21;Sports Bars, Burgers, Pubs, Nightlife, Restaurants, Salad, Bars;535420263;-1135080027;10141-109th Street;;restaurants
XVbyfriDebrJL-db2SsECQ;MR MIKES SteakhouseCasual;25;68;Steakhouses, Restaurants, Canadian (New);5,35233E+11;-1,13624E+12;8882 170 Street, Ste 1647;;restaurants
VzmP1_IoypDfoNEQGGaQTw;Wind Mobile;20;7;Shopping, Mobile Phones, Mass Media;5,35433E+11;-1,13496E+12;10088 102 Avenue Northwest, Suite C103;;shopping
v3HpeD3_Q0YUM19-isldoA;Lava Mediterranean Cuisine;30;7;Restaurants, Mediterranean;5362959;-11349735;16741 100 St;;restaurants
w1cH5PL1j3NciTHk2wgg9A;Nando's PERi-PERi;35;97;Portuguese, Restaurants, African;5347875;-11349304;4228 Gateway Blvd.;;restaurants
ehhsn_ip7P5roo1FHhHteA;Structube;25;5;Home & Garden, Furniture Stores, Home Decor, Shopping, Rugs;5,36005E+11;-1,13556E+12;13550 137 Avenue NW;;shopping
2kv-urkA_UsIzrp_OmbBsg;Running Room;35;16;Fashion, Shopping, Sports Wear, Active Life, Sporting Goods;53521766;-1135115416;8537 - 109 St;;shopping
AxpvYktl1iX-4qakULDT8Q;Harvey's & Swiss Chalet;25;5;Burgers, Restaurants, Fast Food, Food Court;5,35229E+11;-1,13627E+12;8882 170th Street;;restaurants
EgC7mJsoxha1wNw36TeAfw;Boxer Kitchen & Bar;35;6;Italian, Canadian (New), Cocktail Bars, Tapas/Small Plates, Restaurants, Nightlife, Bars;53518806304;-1,13496E+12;10315 83 Avenue NW;;restaurants
L6cA-803X758K5SmDGNFBg;State & Main Kitchen & Bar;30;30;Sandwiches, Nightlife, American (Traditional), Burgers, Restaurants, Bars, Asian Fusion;53435757;-113615484;1237 Windermere Way SW;;restaurants
8AcqFNjZp3gzs66w_g0Aog;The Bedouins;50;40;Restaurants, Arabic, Moroccan, Middle Eastern;53600158;-1135175282;13716 Castle Downs Road NW;;restaurants
Co206M9nTmD92XSatmvL_Q;Bed Bath & Beyond;35;7;Home Decor, Home & Garden, Shopping;536006632;-1134887618;9450 - 137 Ave, Unit 194;;shopping
yYGCoJfHANvtOZ7e51FU5g;Spring Roll Kitchen;25;33;Vietnamese, Restaurants;53455501;-113514514;2395 111 Street NW;;restaurants
6df34MdE_OhbCOdiSpasQA;Majestic Tanning;35;5;Shopping, Beauty & Spas, Tanning, Fashion, Women's Clothing;534537295;-113524952;827 Saddleback Road;;shopping
LMq7dhFLj0pEpVnhjuMppA;Estee's Fabrics;30;6;Arts & Crafts, Shopping, Fabric Stores;534824201;-1134859113;4443 99 Street NW;;shopping
XLrpiX-SgdGgfaEEAKg43A;Earth's General Store;45;34;Home & Garden, Sandwiches, Health Markets, Shopping, Restaurants, Specialty Food, Grocery, Personal Shopping, Food, Organic Stores;535177226;-1134770215;9605 82nd Avenue;;restaurants
ITYK6vL9Ec0MBErKlRc6Pw;Five Guys;40;14;Restaurants, Burgers, Comfort Food, Fast Food;5,35406E+11;-1,1342E+12;5015 101 Avenue NW, Unit 110;;restaurants
7mUhsa1kcQ-COh-TK68mWg;Chez Cora;40;47;Breakfast & Brunch, Restaurants;5,35371E+11;-1,13626E+12;9977 - 178th Street NW, Suite 6;;restaurants
ylVLhB3NEa-X4I2qk3kSvg;La Vie Lente;40;8;Fashion, Accessories, Women's Clothing, Shopping;535182243;-1135011146;10514 82 Avenue NW;;shopping
pO3BhDCAQKOAfEpd598ejw;Joey's Restaurants;25;10;Seafood, Restaurants;5359961;-113532328;12222 137 Avenue NW, Suite 111;;restaurants
qft7HYCM-KvQiXk1oYPQfw;Doyle's Pub;35;6;Nightlife, Pubs, Bars;53612671;-11337912;2619 151 Avenue NW;;bars
3zVcQ-g4OUJoPn_kTl6vyg;Sushi Shop;25;25;Restaurants, Sushi Bars, Japanese;5,34348E+11;-1,13603E+12;5206 Windermere Boulevard;;restaurants
eUWPinQIsS8oBogmk29NAQ;Loft 82;45;6;Women's Clothing, Shopping, Fashion;53518388;-11349729;8213-104 Street;;shopping
0ihbRd1mnVKCP6h8TEpqng;Subway;20;5;Restaurants, Sandwiches, Fast Food;535616294;-113466143;Stadium Station, 8116 112th Ave;;restaurants
_QCfBiJIv1iGHgthFr_CJA;Wings Sports Bar & Grill;40;5;Restaurants, Karaoke, Canadian (New), Chicken Wings, Bars, Nightlife, Sports Bars, Pizza;535701521;-1134729073;8541 - 118 Avenue NW;;restaurants
AtmGgjJVIcWnaTcVDZN_hw;Meat The Bun;40;6;Restaurants, Salad, Burgers, Hot Dogs;534107699;-1134824258;9080 25 Avenue SW, Unit 118;;restaurants
wMrjWiECNxyCASlmUqwdAw;Booster Juice;40;7;Food, Juice Bars & Smoothies;534450598;-1134893052;1707 102 Street;;bars
TjkZr6j8NiaDHEYk5-NL_w;Green Onion Cake Man;45;25;Restaurants, Chinese;535705512;-1134820919;9132 118 Avenue NW;;restaurants
3xnYTpKoPBA3711pQx8yaA;Chili Hot Pot;45;74;Specialty Food, Dim Sum, Restaurants, Food, Chinese, Ethnic Food, Buffets, Hot Pot;535088594;-1134973356;7219 104 St Nw;;restaurants
r06dyqBY7x_WMR9vIbp3CA;Bliss Baked Goods;45;30;Donuts, Custom Cakes, Restaurants, Food, Specialty Food, Kosher, Bakeries;53551573;-113567466;10710-142 Street;;restaurants
iMB5f4Rjz2fRWIBG8FA8vA;100 Street Funicular;40;9;Local Flavor, Active Life, Parks;535402604;-1134894945;10065 100 Street NW;;parks
qV4AEh7g_u5tk6riY1k9jw;The Theatre Garage;45;8;Local Services, Beauty & Spas, Sewing & Alterations, Costumes, Wigs, Arts & Crafts, Shopping, Cosmetics & Beauty Supply, Hobby Shops;534725121;-1134819689;3711 98 Street NW;;shopping
OMFXXPS0Cb0ufvpRKH8pFA;Winners Apparel;30;6;Women's Clothing, Men's Clothing, Fashion, Shopping, Department Stores;5,36029E+11;-1,13446E+12;137th Avenue And 66th Street, Londonderry Shopping Centre;;shopping
jVClilA69uWVeSfI-oUIFQ;The Manor Casual Bistro;35;33;American (New), Canadian (New), Restaurants, Bistros;53542329;-113537234;10109 125 Street NW;;restaurants
xckV3QMDRN8feYVzjrNKZA;The Chopped Leaf;20;5;Restaurants, Fruits & Veggies, Salad, Food Stands, Specialty Food, Food;5,3524E+11;-1,13528E+12;Van Vilet Centre, University of Alberta, 8831 116 Street;;restaurants
5Nw0xeubM3B-40gLwVNUUQ;Dragon FX;25;13;Piercing, Tattoo, Beauty & Spas, Jewelry, Shopping;53563113;-113505103;114 Kingsway Garden Mall;;shopping
1s8KM8GP5X3m7ck57tCFpg;kb & co windermere;45;26;Vegan, Restaurants, Specialty Food, Cafes, Food;534351903;-1136073884;5422 Windermere Boulevard;;restaurants
AZQwbUK45eA5diaGM63xfw;Ricky's All Day Grill;25;13;Breakfast & Brunch, Restaurants;535644598;-1135188507;11431 Kingsway NW;;restaurants
uwjDQsfUuViECXD_zMmyPQ;Shoppers Drug Mart;40;6;Shopping, Drugstores;534957481;-1136659492;6290 199 St NW;;shopping
I2Ipf82-rbAwh0I-X9T0gg;Lotus Cafe;45;6;Restaurants, Cafes, Persian/Iranian, Grocery, Food, Caterers, Middle Eastern, Bakeries, Event Planning & Services, Venues & Event Spaces;5,35453E+11;-1,13536E+12;10321 124 Street NorthWest;;restaurants
FQLqYDotDp2OjO_qJKu20A;Hilltop Pub;30;16;Pubs, Dive Bars, Nightlife, Sports Bars, Bars;53549548;-11345489;8220 106 Avenue NW;;bars
4SZCNz30VKLesMvW_zAs7Q;Three Vikings;45;29;Bars, Nightlife, Beer, Wine & Spirits, Restaurants, Food, Scandinavian, Breakfast & Brunch, Pubs;535514622;-1135353819;10713 124 Street;;restaurants
-UkBFs6zsvNmfLtkjEZolw;Kids' Furniture Gallery;35;8;Home & Garden, Furniture Stores, Baby Gear & Furniture, Shopping;534719328;-1134855559;3805 99 Street NW;;shopping
YshBHMZJhbAJ3nmjr9xUGQ;Stages Kitchen & Bar;40;30;Buffets, Restaurants, Coffee & Tea, Food, Canadian (New), Breakfast & Brunch, Local Flavor, Beer, Wine & Spirits;535549551;-1136076353;16615 109th Avenue NW;;restaurants
q_LBY19RK0HYf-ODpDjdVw;The Wish List;40;17;Home Decor, Home & Garden, Shopping, Flowers & Gifts, Jewelry;535182966;-113499955;10464 Whyte Ave;;shopping
z1JfKhOkJXtVejXdRyu3Fg;La Bodeguita De Cuba;45;7;Restaurants, Cuban;53570675;-1134745851;11810 87 Street NW;;restaurants
WuXkH8FlXI07UF7b0O4noA;HER GYMVMT - NorthGate Centre;20;7;Active Life, Trainers, Fitness & Instruction, Gyms, Day Spas, Shopping, Beauty & Spas, Shopping Centers;535982563;-1134873751;9499 137 Ave., 1040;;shopping
CEOZo_DTIO6rXEMJHNtTJg;Starlight Casino;35;18;Arts & Entertainment, Casinos;5,35225E+11;-113622203;8882 170 Street NW, Suite 2710;;arts
n24APiymWrGNklmgtqJQlw;La-Z-Boy Home Furnishings & Décor;25;8;Home & Garden, Interior Design, Home Decor, Home Services, Furniture Stores, Shopping;53449522;-1134872177;2006-101 Street NW;;shopping
kHL00cuNothLsacKCvF3zA;New Asian Village Restaurant;35;46;Indian, Restaurants;53466333;-113475181;9308 34 Ave NW;;restaurants
25uEEaWkWO5PHg_bh9BZwg;Thai Express;25;8;Restaurants, Thai;53564194;-113508499;109 Street & Princess Elizabeth Avenue, Suite 425, Kingsway Mall;;restaurants
ig7GkVCAiXhnPjDSGPo0mA;Laura;40;5;Accessories, Shopping, Fashion, Women's Clothing;535224397;-1136218712;8882-170th Street;;shopping
jgG7CsnFcHPUjAKbP73fxQ;Polar Spas;10;9;Skin Care, Shopping, Home & Garden, Hot Tub & Pool, Beauty & Spas;534919171;-1134857487;5605 99 Street;;shopping
2KhwR5XB2u88e3AgH4mq5w;Monty's Pizza;45;42;Pizza, Restaurants, Italian, American (Traditional);5,35141E+11;-1,13677E+12;1027 Potter Greens Drive NW;;restaurants
gZ37igy0K1NICwlZUsE46A;Panago Pizza;30;12;Pizza, Restaurants, Food Delivery Services, Chicken Wings, Food, Salad;535458152;-1135133665;10375 - 112th Street;;restaurants
emv2P-5mzQCN9H07ci0w8g;Pizza City Donair & Broast;35;25;Halal, Donairs, Restaurants, Pizza, Food;53439645884;-1,1362E+11;5572 Windermere Boulevard SW;;restaurants
_MM6uUK_M-trJtifosyUYw;Bonanza Western Grill;25;13;Buffets, Restaurants;535997146;-1135396444;12536 137 Avenue NW;;restaurants
dAMToybLb93nvdfE5J4WOw;MAC Cosmetics;35;17;Shopping, Beauty & Spas, Cosmetics & Beauty Supply, Makeup Artists;53485637;-113513689;5015 111 St Nw, Space 324;;shopping
qiGHAWeOtBAETFC9CpQpwQ;Aldo;30;5;Shoe Stores, Fashion, Shopping;535224397;-1136218712;8882 170th Street;;shopping
Uh2NXXr6Q_s3lHf81P6UqQ;Maven and Grace;45;6;Shopping, Antiques;535176982;-1134769488;9601 82 Avenue NW;;shopping
E25uPD44vAUoDoeKnv6SQw;Irie Foods;30;8;Restaurants, Caribbean;535182744;-1134931417;10152 82 Avenue NW;;restaurants
CsRL2V3oMoGIp924cAa1yw;Papa Murphy's Take 'N' Bake Pizza;45;8;Pizza, Restaurants, Salad;536156684;-113541834;15220 127 Street;;restaurants
AVupQjOJWsQbbEYwCtNQDA;The Greenhouse;45;14;Vegetarian, Food, Salad, Specialty Food, Health Markets, Restaurants, Gluten-Free;535413846;-1134934165;10119 101 Street;;restaurants
Dzb6tHPsm3CyVubJm3Cd3A;SPLASH POKE;40;19;Hawaiian, Restaurants, Poke, Food, Japanese, Seafood;534774869;-1134971426;4112A Calgary Trail NW;;restaurants
vCCK94i-qZWeVAD3-vPNaA;Sorrentino's;35;17;Italian, Restaurants;535556616;-1134845926;10844 95 St;;restaurants
Z03QeLtc9PjlkSNqbdFdXw;Remedy Cafe;40;82;Restaurants, Desserts, Indian, Food, Cafes, Coffee & Tea;5354479102;-1,13536E+12;10310 - 124 Street NW;;restaurants
kqKN3YyDhFoi1RFKmwIEFw;Japanese Village;30;19;Steakhouses, Sushi Bars, Restaurants, Seafood, Japanese;5,35983E+11;-1,13487E+12;9499 137 Avenue, Suite 1084B;;restaurants
8xUTHj6Yfgs1fY4JY5U2sw;Chili's Texas Grill;30;17;Restaurants, Steakhouses, Sports Bars, Pizza, Bars, Nightlife, Tex-Mex, Mexican, Canadian (New);5,34375E+11;-1,13603E+12;6143 Currents Drive;;restaurants
sN_S2xk66XA3jIaP6hCA8g;When Pigs Fly;30;15;Flowers & Gifts, Fashion, Home & Garden, Accessories, Toy Stores, Jewelry, Arts & Crafts, Home Decor, Shopping, Kitchen & Bath;5351821118;-1,135E+12;10470 82 Avenue North West;;shopping
BjA1Q15OFdU77LImrojKkg;Good Stuff Consignment;40;7;Shopping, Fashion, Shopping Centers, Used, Vintage & Consignment;5,35514E+11;-1,13568E+12;10704 142nd Street;;shopping
7Xanvny1WluYxZJc_UW-hQ;Jt's Bar & Grill;35;10;Lounges, Bars, Restaurants, American (Traditional), Nightlife;534451008;-1134432095;1107 Knottwood Road E NW;;restaurants
E8Et1NE9kJ4YKUN0E6gQIA;Edmonton Opera;50;7;Opera & Ballet, Arts & Entertainment;535852918;-1135837376;15230 128th Ave NW;;arts
yTj0A59UsS6ZLw54FuC1_w;Boun Thai Restaurant;40;5;Restaurants, Thai;535404559;-113504996;10056 - 107 Street NW;;restaurants
8MzlreHr5tUxXM_Maqm1eg;McDonald's;20;21;Food, Restaurants, Coffee & Tea, Burgers, Fast Food;5,34245E+11;-1,13514E+12;11053 Ellerslie Road;;restaurants
