business_id;name;rating;review_count;category;lat;lon;address;phone;category_source
zIxGYrFohyF-ZDvXDXZsLw;Tandoori King;45;7;Indian, Restaurants;534451139;-1134190899;1523 50 Street NW;;restaurants
xmmLJhIQMquPtyLk02knIQ;Bangkok Kitchen;35;31;Restaurants, Thai;535395681;-1135930881;15726 100 Ave NW;;restaurants
6s3ggOkDgdxtkVoYlLVgQw;Koryo Korean BBQ;40;13;Restaurants, Korean, Fast Food;53523059;-113620344;8882 170 Street;;restaurants
YwoZ379xrP3ZaakRODOXfg;Sofa Land;40;11;Furniture Stores, Home & Garden, Home Decor, Shopping;534502899;-1134819609;2027-98th Street;;shopping
pZl68OjM4Fz0Ms0raK69Bg;McDonald's;20;10;Coffee & Tea, Restaurants, Fast Food, Burgers, Food;535593399;-1,13502E+12;10520 111 Avenue NW;;restaurants
cx0vkD-d3e5NWLVOlrrxvA;Rendezvous Pub;40;6;Nightlife, Bars, Pubs, Sports Bars;53542068;-113578738;10108 149 Street;;bars
254qcgxvWf6n_8SU2leOQA;Sole Experience;45;11;Shoe Stores, Fashion, Shopping;535179164;-1135096767;10805 82 Avenue NW;;shopping
qXQvFzm0n9nMc_gsOfzU7Q;The Edmonton Book Store;30;15;Bookstores, Books, Mags, Music & Video, Shopping;5,35179E+11;-1,13502E+12;10533 82 Avenue;;shopping
G3YP-rOrzN5XhLeB3aH_Jw;Save-On-Foods;35;8;Pharmacy, Grocery, Food, Shopping, Drugstores, Health & Medical;536015644;-1134477833;1 Londonderry Mall NW;;shopping
Lh3bCDJiO596SXir6e2T0A;Delux Burger Bar;35;23;Burgers, Restaurants;5,35233E+11;-1,13624E+12;West Edmonton Mall, Bourbon Street;;restaurants
7uS3AAV7Scm1Uuv2dfqc4Q;KFC;10;6;Restaurants, Food, Chicken Shop, Chicken Wings, American (Traditional), Fast Food;535391924;-113626789;10021 178th Street;;restaurants
4U9ZDOP64JBLg2arr46lew;Yvonne’s Furniture;40;6;Shopping, Furniture Stores, Home & Garden, Mattresses;53588163;-113564459;12938-St Albert Trail;;shopping
kjgaUSLf59qNYeus0ZWhpw;Elegance Goldsmith;50;14;Jewelry, Local Services, Shopping, Appraisal Services, Jewelry Repair;535558369;-113491315;10918 97 Street NW;;shopping
Rb26mGIH6BHAoGl6OksJPQ;Mazaj Mediterranean Bar & Grill;45;5;Venues & Event Spaces, Bars, Nightlife, Restaurants, Hookah Bars, Event Planning & Services, Mediterranean, Middle Eastern;535419989;-1136107758;224 Mayfield Common Northwest;;restaurants
LTN42gW-zNi2lceVPoW_tg;Afghan Chopan Kebab;30;26;Afghan, Restaurants;535526875;-1134940814;10756 - 101 Street;;restaurants
aNc9dpUcbJ654tGdfDytMg;Dim Sum Delight;45;15;Chinese, Dim Sum, Restaurants;535549024;-113616462;10812-170th Street;;restaurants
8OWC8NRVMACtu7hh8GFLNw;Ramada by Wyndham Edmonton South;20;5;Event Planning & Services, Hotels, Hotels & Travel;53491897198;-1,13495E+12;5359 Calgary Trail, Highway 2 And 53rd Ave;;hotels
vs_0Znpr7vyg8zoxPl59sw;Tiramisu Bistro;40;83;Italian, Breakfast & Brunch, Gluten-Free, Restaurants, Vegetarian, Pizza;535523615;-1135361652;10750 124th Street;;restaurants
GI9t5STLrfPcowdXjeomag;Pizza Depot;45;6;Restaurants, Pizza;5,34588E+11;-1,13393E+12;3373 28A Avenue NW;;restaurants
HfSMI-jO3iYvgDTVrwYo-w;Howard Johnson Hotel by Wyndham Edmonton;20;6;Hotels, Event Planning & Services, Hotels & Travel;535420079;-113589442;15540 Stony Plain Road;;hotels
Hd7kCbQJH4KyGdBxSNML1Q;That's Aroma;30;9;Restaurants, Italian;535573393;-1134940092;11010 101 Street NW;;restaurants
BhVW7iBhCS3o3QgdKnQFag;Beaver Hill House Park;25;6;Burgers, Active Life, Restaurants, Parks;5,35412E+11;-1,13501E+12;10440 Jasper Ave NW;;restaurants
6paAfLcNLzODCU303XcUAA;Riteway Plumbing;45;13;Home Services, Water Purification Services, Shopping, Heating & Air Conditioning/HVAC, Kitchen & Bath, Home & Garden, Plumbing, Water Heater Installation/Repair;535705252;-1134063506;4202 118 Avenue NW;;shopping
VgX9yU_XnMTmOJjsIu85Bw;A&W;30;5;Fast Food, Burgers, Restaurants;5,34982E+11;-1,13419E+11;6104 50th Street NW;;restaurants
VPiDv0WcM7SwF_gtegtbZw;Buffet Royale Carvery;20;37;Seafood, Restaurants, Buffets;53465492;-113492975;3318 Gateway Boulevard NW;;restaurants
EB0d9vOJHb3CssNf-Y17Tw;Buono Pizzeria & Grill;40;15;Nightlife, Pizza, Wine Bars, Italian, Restaurants, Bars;5,35212E+11;-1,13578E+12;8776 149 Street NW;;restaurants
Vihk5qRtrbnVZ5yZZrJi1A;FC Edmonton;40;6;Arts & Entertainment, Professional Sports Teams;535582636;-1134764944;Clark Stadium, 11000 Stadium Rd NW;;arts
U4EUgrGD-4kQVBQq9tfDAg;B Street Bar Wood-Oven Pizza;30;31;Dive Bars, Nightlife, Pizza, Bars, Restaurants, Sports Bars, Karaoke;53559191;-1135256334;11818 111 Avenue NW;;restaurants
_5ZyrboEvdEyOg2a5cgEpg;Tony's Pizza & Italian Restaurant;40;98;Restaurants, Pizza, Italian;535590907;-1134898373;9605 111 Avenue NW;;restaurants
gXGU91yRrxKLWuA6wpeA-w;Culina Muttart;35;69;Canadian (New), Breakfast & Brunch, Restaurants, American (New);535352125;-1134773055;9626 - 96A Street;;restaurants
7QunggGMjTCA_2sfXrKTng;Constable Ezio Faraone Park;40;9;Active Life, Parks;535340812;-1135104576;11004 97 Avenue NW;;parks
vr60W5p56OpKMUJz2ET3rA;SkyShuttle Airport Service;20;36;Transportation, Airports, Hotels & Travel, Airport Shuttles;534625167;-1134898001;10135 31 Ave NW;;hotels
upsWZ1DvMo1b32MskUaM3w;Edo Japan;30;9;Fast Food, Restaurants, Japanese;53451954;-113487496;10016 - 21 Ave NW;;restaurants
gZB9oxsXlcPbyp7lY-s0EA;Packrat Louie;35;68;French, Canadian (New), Bars, Nightlife, Restaurants, Pizza, Italian, American (New);535189441;-1134971398;10335 83 Avenue NW;;restaurants
2joz26si509_AqbE7PSPPw;Harvey's;40;11;Burgers, Restaurants, American (Traditional), Fast Food;535458213;-1135088929;10358 109th St NW;;restaurants
fGSjNsL-PbREId09Pdqv-A;Banh Mi Cali;40;5;Vietnamese, Restaurants, Sandwiches;535573402;-1135014147;10503 Kingsway NW, #3;;restaurants
YW_gLHMbNL6f8lNxfZSmjA;Sandman Signature;35;12;Hotels & Travel, Hotels, Event Planning & Services;534247482;-1134909967;10061-10123 Ellerslie Road SW;;hotels
-m_fl--6j4DFv1RlOtuL1g;Sukhothai Restaurant;30;24;Thai, Restaurants;535458296;-113520614;11525 104 Avenue NW;;restaurants
sky7fYnpxjmg8tSq6QPT_g;Extreme Pita;40;5;Restaurants, Sandwiches;535989265;-1134038333;13732- 40th Street NW;;restaurants
YS7K3x0YFcByLXT2wWDV4g;Rapid Fire Theatre;45;14;Comedy Clubs, Art Schools, Specialty Schools, Ticket Sales, Nightlife, Education, Arts & Entertainment, Performing Arts;5351992;-113495989;10330 84 Avenue NW;;nightlife
c4WjOzTvpMvAxmUspHfhOQ;Sicilian Pasta Kitchen - SPK Downtown;35;98;Italian, Restaurants;535408509;-1135154098;11239 Jasper Avenue NW;;restaurants
aU69S81sC9c1sc0Mz2jBgg;Pho Boy;40;66;Vietnamese, Restaurants;5351766;-113490238;10037B 82 Avenue;;restaurants
Me9keL6YmiAy7vyjBAIV7Q;Take Five;45;53;Restaurants, Donuts, Food, Sandwiches, Soup;535706505;-1134146675;11801 48th Street NW;;restaurants
7FZOsWGMunx1QV5fiIHDnw;Shumka Ukrainian Foods;40;10;Ukrainian, Restaurants;53627482;-1134875136;16520 95 Street NW;;restaurants
TGrOAl92gipX0_ltl2vG2g;The Plaid Giraffe;45;21;Jewelry, Shopping, Gift Shops, Watches, Accessories, Fashion, Flowers & Gifts;53518387;-1134965056;10340 82 Avenue NW;;shopping
_DT4ILXzj8p9j5IZYlM2Pw;A Taste of Edmonton;35;63;Arts & Entertainment, Local Flavor, Festivals;535366856;-1135054194;108 St & 99 Ave;;arts
W3R7fiz28O4Nbsi9BkRuEA;Bella Casa;45;5;Shopping, Kitchen & Bath, Home Services, Home & Garden, Interior Design, Home Decor;535341713;-113566738;9646 142 Street NW;;shopping
KtUUuDO55mveOCV5MSNHgg;Olive Garden Italian Restaurant;30;76;Restaurants, Wine Bars, Salad, Italian, Nightlife, Soup, Bars;5,35425E+11;-1,13616E+12;10121 171st Street;;restaurants
7ajMzTxK36-EJMGhXSxx2w;TC Sandwiches;45;10;Sandwiches, Restaurants, Vietnamese;535237678;-1136165418;8882 170 Street NW;;restaurants
aFE0SdcfNN8mEbTv8rV1RA;The Hexagon Board Game Cafe;45;44;Coffee & Tea, Restaurants, Food, Shopping, Tabletop Games, Hobby Shops, Cafes;535183748;-1135083947;10750 82 Ave NW;;restaurants
vjRW-bH1wQKEIL7tbn83uw;KFC;15;5;Restaurants, Chicken Wings, Chicken Shop, Fast Food, American (Traditional);535591512;-1135365593;12408 - 111th Avenue;;restaurants
KBjSxFyWYLAr6gRxPzoLwA;Southview Acura;15;9;Automotive, Car Dealers, Tires, Car Buyers, Auto Parts & Supplies;534683854;-1134834999;9820 34 Avenue NW;;arts
HozkgcmQY1VYfBeTOreztQ;Jovic Bakery;15;14;Shopping, Food, Event Planning & Services, Arts & Crafts, Bakeries, Cooking Classes, Party & Event Planning;535248395;-1136667774;870 Webber Greens Drive NW;;shopping
IMgg5CeDORH6k5bvZRYiww;Yaymaker;35;16;Party & Event Planning, Art Classes, Social Clubs, Event Planning & Services, Education, Arts & Entertainment, Party Supplies;53544389;-1134909267;;;arts
ape6bdfsWQ9eSCbRnokhxA;Knifewear;50;24;Shopping, Local Services, Home & Garden, Kitchen & Bath;535181683;-1135101872;10820 - 82 Avenue;;shopping
5bcngipnLPwSR9mDbA2ahA;Greta;30;8;Bars, Arts & Entertainment, Nightlife, Arcades, Restaurants;53542038;-1135080027;10141 109 Street NW;;restaurants
1CcGm-DnoDQKx1Myi3ABQg;Nhon Hoa Sandwich Bar;40;40;Restaurants, Vietnamese, Sandwiches;53518302;-113493333;10154 82 Avenue;;restaurants
QSp67ypZxxrD6X2w-uETJQ;Costco Wholesale;35;19;Food, Shopping, Wholesale Stores, Grocery, Drugstores;53596153;-113416989;13650 50 Street NW;;shopping
Paoz_eMXP7dodUBUD8n6Sg;Jimmy The Greek;35;11;Fast Food, Greek, Restaurants;53564194;-113508499;Kingsway Mall, 109 St & Princess Elizabeth Ave;;restaurants
BjBCp45RbffPyeETRf813Q;Sandman Hotel Group;25;9;Hotels, Event Planning & Services, Hotels & Travel;5,35406E+11;-11362695716;17635 Stony Plain Road NW;;hotels
jnc9NMlkblFDVOf2xChMvg;House of Quon;30;11;Restaurants, Ethnic Food, Food, Chinese, Specialty Food;535995732;-1135426846;12722 137 Avenue NW;;restaurants
2ZDTYLpYWMPVs88Mn5QKFQ;Sunglass Hut;35;5;Eyewear & Opticians, Shopping, Sunglasses;535609444;-1135085079;109 Street & Kingsway, 173, 1st Level;;shopping
uuPhvUsXNaJKcwrA_dceLw;La Senza;30;7;Fashion, Lingerie, Shopping;53485689;-113513781;34 Southgate Shopping Center NW;;shopping
d0rA1HNQBW6u-emgFISD9g;Structube;20;26;Home & Garden, Furniture Stores, Shopping;5,34409E+11;-1,13491E+12;10179 13 Avenue NW;;shopping
jNcL74qWy-AbGu2SB4JgLQ;Nara Hookah Lounge;25;7;Bars, Nightlife, Restaurants, Buffets, African, American (Traditional), Hookah Bars;5,35805E+11;-1,13491E+12;12433 97 Street NW;;restaurants
EQct7u-1sr2OlPSJ5LHvSg;Wok This Way;40;35;Restaurants, Vietnamese, Chinese;534768387;-1134174821;4028 - 50 Street;;restaurants
d43qz3rfHHly6_IUnE0mVA;Kinnikinnick Fresh;45;21;Food, Grocery, Gluten-Free, Restaurants, Bakeries, Specialty Food;535569989;-1135295334;10940 120 Street NW;;restaurants
13yl6DMh-Dei9DwY_UWUuQ;Nello's Restaurant;40;17;Restaurants, Italian;534545617;-1134957905;2920 Calgary Trail;;restaurants
f_rKUmaqr6uB8Wk0Z7O7OA;Max's Restaurant - Edmonton;35;38;Restaurants, Filipino, Food;535693287;-1135684384;11650 142 Street NW;;restaurants
oS_i_WSEMwNulxRECiM00Q;Aroma Cafe;45;6;Delis, Restaurants, Coffee & Tea, Food;535200445;-1134552628;Bonnie Doon Shopping Centre, 83rd Street NW;;restaurants
lvNx6pLRZRQH1WyrUqfJyQ;Station on Jasper;35;17;Arts & Entertainment, Music Venues, Bars, Nightlife;535412185;-1135018987;10524 Jasper Avenue;;bars
bahXyVAoRAWWxbwmFtuEdA;Wild Wing;25;37;Restaurants, Chicken Wings;5,34718E+11;-1,13495E+12;640 - 3803 Calgary Trial;;restaurants
BEhVBmTnl1wo01Wl5Rzpbg;Brick & Whiskey Public House;30;12;Nightlife, Music Venues, Bars, Arts & Entertainment, Karaoke, Pubs;53517815;-113466585;8937 Avenue NW;;bars
vNrkZsg_j8HCAe8L7xUJ8w;The Bay;35;13;Department Stores, Fashion, Shopping;53484858;-113513611;51-5015 111 Street NW;;shopping
sPOzYBerW0Y3KwJ60mtHwA;Soleilki Japanese Fusion;40;11;Japanese, Sushi Bars, Restaurants, Ramen, Tapas/Small Plates;5,35184E+11;-1,13511E+11;10828 82 Avenue NW;;restaurants
4-HJQtuLSQ0olOxfGjwG5A;Lego Store;45;17;Shopping, Toy Stores;534862128;-1135146547;5015 111 Street Northwest;;shopping
C9J691R-fF24t-zjbOgVaQ;Love Pho;40;31;Vietnamese, Restaurants;534273865;-1134831654;652 Parsons Road SW;;restaurants
L_DMBHYChySL-U6U3Kcztg;Haweli Restaurant;35;43;Indian, Restaurants, Pakistani;535435145;-1134976116;10220 103 Street NW;;restaurants
k8Kh17B9El3zPIDAhLdMeQ;Apple Store;35;45;Mobile Phones, Mobile Phone Repair, Shopping, Computers, Electronics, Electronics Repair, Local Services, IT Services & Computer Repair;5352224;-113620963;8882 170 Street NW;;shopping
4fJ6cBlYAdlwsWiz-NW-0Q;Pho Hoan Pasteur;40;87;Restaurants, Vietnamese;535644934;-1135194977;11443 Kingsway NW;;restaurants
Ai8MnqWUCTT03knlsrDSOQ;McDonald's;15;11;Food, Coffee & Tea, Fast Food, Burgers, Restaurants;535155195;-1134950977;10305 80th Ave.;;restaurants
TAGBPF2SMihv1q5q8fTHTw;lululemon athletica;35;10;Shopping, Women's Clothing, Active Life, Sporting Goods, Yoga, Fitness & Instruction, Fashion, Sports Wear;53522695;-113621363;8882 170th Street, Unit 2846;;shopping
ORgOWPkxsfY81CiwKy6kJg;Pop Culture Fair;30;5;Toy Stores, Books, Mags, Music & Video, Comic Books, Shopping, Hobby Shops;53565935;-1135171273;Alberta Aviation Museum, 11410 Kingsway Avenue NW;;shopping
QYDR8X2unoOz9DLg32REDg;Tropika Malaysian Cuisine;35;57;Indonesian, Thai, Restaurants, Malaysian;534970622;-1134980783;6004 - 104 Street;;restaurants
3PlZoKBDXvpadM8ZVunTGQ;The Almanac;40;42;Gastropubs, French, Breakfast & Brunch, Restaurants;535179055;-1134968409;10351  82 Avenue NW;;restaurants
GYnny7OMIaUoaeTrAJ_8DA;Crate and Barrel;35;17;Shopping, Home & Garden, Home Decor, Shopping Centers, Rugs, Furniture Stores, Kitchen & Bath;534856393;-1135136882;5015 111 Street NW;;shopping
e6lLQKTfAaFKqhlU_SvCYA;Native Delights;40;9;Burgers, Cafes, Hot Dogs, Restaurants, Canadian (New);53558164;-113529996;12011 111 Avenue NW;;restaurants
zgXM5Pdk08NqoH3uTAltkg;Campus Tower Suite Hotel;40;5;Hotels, Event Planning & Services, Hotels & Travel;535228122;-1135198905;11145 87 Avenue;;hotels
ZS0jla70jNGsWd-5g1UFLA;PhoXpress;25;9;Restaurants, Vietnamese;5,34928E+11;-1,13665E+12;6031 199 Street;;restaurants
fVGIbM0-y9XvT47SE4CiCQ;Black's Photography;35;8;Photography Stores & Services, Shopping;5,34856E+11;-1,13515E+12;304 Southgate Shopping Center NW;;shopping
_E5b8t2R-VLl87-sLT4WcA;Privé Ultralounge;20;17;Arts & Entertainment, Music Venues, Bars, Dance Clubs, Nightlife;535449234;-113512813;10304 111 Street NW;;bars
KKNDGNg7_QjL7kswHEE7bg;A-Plus;35;5;Japanese, Chinese, Restaurants, Canadian (New), Food, Desserts;53522893;-1135199294;11149-87 Avenue;;restaurants
NBi-yKGFQq4hYimCxA9lnw;Soda Jerks;30;8;Burgers, Restaurants;5,34543E+11;-1,13376E+12;2330 23rd Avenue NW;;restaurants
tX7LB6sloQNwxIbcaA0A0A;Queue Clothing;25;6;Men's Clothing, Shopping, Women's Clothing, Fashion;535187239;-1134978246;8216 104 Street NW;;shopping
AoboRmPP2tFZctiav2VAdQ;McDonald's;20;5;Restaurants, Coffee & Tea, Food, Fast Food, Burgers;5,35616E+11;-1,13467E+12;8132 112th Avenue NW;;restaurants
oaMk8KNzjN3fdk5aYQBXrg;Hair Angels Extensions Salon;40;5;Shopping, Beauty & Spas, Hair Salons, Hair Extensions, Hair Loss Centers, Wigs;53546417;-1136040615;10030-164 Street;;shopping
fLcLyuu7VSAsZ_8pFHdU-g;Woodshed Burgers;35;60;Beer, Wine & Spirits, Food, Ice Cream & Frozen Yogurt, Bars, Burgers, Gluten-Free, Wine Bars, Beer Bar, Nightlife, Restaurants;53551812;-1135356059;10723 124 Street NW;;restaurants
U_E9OctQ_MmSjaNFsp5j3Q;Barbecue Country;35;9;Home & Garden, Shopping, Grilling Equipment, Appliances;534931055;-1134440946;5682 75 Street NW;;shopping
RoHXnFTGKrUbgWd9eug3LQ;S'wich;40;8;Food Trucks, Sandwiches, Restaurants, Food;535186043;-1135286611;104 Street and Jasper Avenue;;restaurants
mwY2fRc4vuyG1CyofJjqfQ;Radisson Hotel;35;18;Event Planning & Services, Hotels & Travel, Hotels;534825681;-1134936833;4440 Gateway Boulevard;;hotels
L5jw_4-FqQcQN6xP30f8yg;Taipan Cafe;30;41;Chinese, Restaurants;53550937;-113488688;10627 97 Street NW;;restaurants
7K7zi2qilGt2zE9B1LC_TQ;West Side Mitsubishi;20;14;Auto Repair, Auto Parts & Supplies, Automotive, Car Dealers;535428138;-1136318768;10152-179 Street NW;;arts
_-jdAIUs1nZt9eBuU4ramg;Enterprise Rent-A-Car;20;8;Car Rental, Hotels & Travel;53473523;-11348529;3859 99th St;;hotels
1tm-CQ4-dFxY03fAScQ01A;McDonald's;20;18;Restaurants, Burgers, Fast Food, Coffee & Tea, Food;53546627523;-1,13523E+12;11660 104th Avenue;;restaurants
axLfdXz-hV7_ev2Ne3s9mw;Tim Hortons;30;8;Sandwiches, Delis, Coffee & Tea, Bakeries, Food, Donuts, Restaurants;535991426;-1133882219;2943 137 Avenue;;restaurants
zypzBqMAwOtpbwg8xSfIQw;Booster Juice;15;5;Food, Juice Bars & Smoothies;534592847;-1134280605;6136 28 Ave NW;;bars
iU9Kg-itUBlnwsiiXmmnaA;Mastermind Toys;35;7;Toy Stores, Shopping, Personal Shopping;53535203;-113617251;9752-170 Street;;shopping
FreQwe5GxnFKT7dJk8IKFQ;Petite Bakery;35;14;Gluten-Free, Restaurants, Desserts, Food, Bakeries;5,35225E+11;-1,13624E+12;8882 170 Street;;restaurants
QkIkWiwrT6FbAtZrSKhGLg;Dairy Queen Grill & Chill;25;7;Ice Cream & Frozen Yogurt, Burgers, Restaurants, Food, Fast Food;53506273;-1134857927;9855 70 Avenue NW;;restaurants
Y5D23yBTmZlxgAHIwLyuJw;Pizza Hut;20;9;Restaurants, Chicken Wings, Pizza, Food, Food Delivery Services, Italian;535388887;-1,13627E+11;10011-178 Street;;restaurants
EXONaa9dDEMQcBShzzou1A;Stadium Donair;30;12;Donairs, Pizza, Food, Restaurants;535608845;-1134669352;8157-112 Avenue;;restaurants
vqq18oM8_gsfl24ndr2LLQ;Tokyo Express;25;11;Restaurants, Japanese;53520751;-113593005;156 Street & 87 Avenue, Suite 264;;restaurants
8ohbOM0ulHhPuNAbtTMvbQ;The Wired Cup;40;12;Arts & Crafts, Home & Garden, Home Decor, Shopping, Coffee & Tea, Food;535315681;-1134673608;9418-91 Street;;shopping
gayjHl5TinOfNGiaDtGYlQ;High Level Bridge;45;8;Local Flavor, Tours, Hotels & Travel;5,3531E+11;-1,1351E+12;;;hotels
EalujQs-gOMWCETWiHXkCw;Café Beirut;40;12;Middle Eastern, Restaurants;535181689;-1135100086;10812 Whyte Ave;;restaurants
shhLEpL0BGni58akTfaxLw;Syphay Restaurant;40;6;Thai, Restaurants;53482643;-113495749;4428 Calgary Trail NW;;restaurants
xXsjwJRdhnNSuQiyi9lxkQ;Sage Restaurant;35;35;Restaurants, Diners;53510391;-113696134;300 E Lapotac Boulevard;;restaurants
JKhU2c9JIbD3WaxoxSiZjA;Chateau Louis;35;18;Event Planning & Services, Hotels & Travel, Hotels;535663856;-1135224999;11727 Kingsway NW;;hotels
7-_M7hkyR6pp9O7L82sDvA;Knights Pub & Grill;30;11;American (Traditional), Nightlife, Karaoke, Pubs, Chicken Wings, Bars, Restaurants, Pizza;53607488;-113526828;11860 145th Avenue NW;;restaurants
y_W-gFtXL9PWunhBibuvjA;OEB Breakfast ;40;58;Restaurants, Breakfast & Brunch;53544448948;-1,13536E+12;56 - 10240 124 St;;restaurants
t1TNA266A8TIm-pGZX_zVg;Walmart;25;16;Shopping, Fashion, Food, Department Stores, Grocery;53539191;-113420543;5004 98th Avenue NW, Suite 1;;shopping
Fn_QHv9llAuewBIIE3O6EQ;Plum Home & Design;40;6;Home & Garden, Home Decor, Shopping;5,3543E+11;-1,13531E+12;12021 102 Avenue;;shopping
LLIO3KSa7sPfGKg6dRBTIw;Wing Snob;45;18;Chicken Wings, Restaurants;5,35474E+11;-1135283314;11988-104 Avenue, Building 4;;restaurants
E79pOKKFr60ezASjkjAGbw;Up! 99.3 FM;25;8;Radio Stations, Arts & Entertainment, Mass Media;535461245;-1134938229;;;arts
2GwHEeFh2aydaUx5QkFbwg;Culture Craze;25;5;Jewelry, Shopping;535225151;-1136241906;West Edmonton Mall;;shopping
4j7E-COjWKjC-S1Yr8eX_Q;Vietnam's Express;40;7;Vietnamese, Restaurants;534597544;-1134938419;109 2920 Calgary Trail Northwest;;restaurants
v7Ir-UMN_BURQ-92is2v8g;Whitemud Dr Amusement Park;30;8;Amusement Parks, Active Life;534870542;-1134414235;7411 51 Avenue NW;;parks
Zyl1ZsM7g-ZI3Mcl2KiivA;Sound Connection;30;5;Shopping, Books, Mags, Music & Video, Vinyl Records;53518276;-113489383;10016 82 Avenue NW;;shopping
SmeQYod1yQF4BamES424qQ;Mona's Pizza & Donair;30;5;Restaurants, Pizza;535952568;-1135055236;10706 134 Avenue NW;;restaurants
4t1VMmixGuvj6jKhWGLVWg;McDonald's;25;7;Restaurants, Fast Food, Burgers, Food, Coffee & Tea;536319193;-1135422961;16940 127th Street NW;;restaurants
1rN5JlJuoJxHppuS49qxDQ;Chatime;40;8;Bubble Tea, Restaurants, Cafes, Food;5,36011E+11;-1,13496E+12;9940 137 Avenue, Suite 104;;restaurants
h-2NPS4ZKdGtcngTvQJo7Q;Chutneys Indian Grill;35;11;Fast Food, Indian, Salad, Mexican, Restaurants;53479615;-113372426;4316 17 Street NW;;restaurants
H_m3cZIW9zFQSWhUt-gR7w;Notables Stationers;40;19;Cards & Stationery, Shopping, Flowers & Gifts, Event Planning & Services, Hobby Shops, Arts & Crafts;535429099;-1135378178;12543 102 Ave NW;;shopping
p8GvT9-Y1LAANqeizdJkwQ;Nak's Bistro & Catering;45;9;Bistros, Food, Event Planning & Services, Restaurants, Desserts, Caterers, Sandwiches, Delis;53547993;-113617438;10451 - 172 Street;;restaurants
JTgLVk7jMczBeM3XDrmKJA;Optiks International;30;5;Eyewear & Opticians, Shopping;535426008;-1136136465;156 Mayfield Common;;shopping
yLxaZdt68_fCLQlJ1i26zQ;EB Games;20;5;Video Game Stores, Videos & Video Game Rental, Shopping, Books, Mags, Music & Video;535987432;-1134037652;Clareview Shopping Centre, 40 Street Northwest Suite 13740;;shopping
mJVNXkfExLzzsXvbaY-ymw;McDonald's;25;7;Fast Food, Burgers, Restaurants, Food, Coffee & Tea;535408272;-1,1361E+12;16725 Stony Plain Rd.;;restaurants
GPFos2EQg75fzKLbKGejeQ;Maggie Walt Design;40;5;Pop-up Shops, Accessories, Women's Clothing, Shopping, Fashion;53544389;-1134909267;;;shopping
Jmfp5HP3rBb0lkSQwvpf-w;Value Village;35;17;Thrift Stores, Shopping, Fashion, Local Services, Used, Vintage & Consignment, Community Service/Non-Profit;5,35984E+11;-1,13425E+12;13530 Fort Road NW;;shopping
zDwZzFcr_utKtIAywd6mLA;Chef Hung Taiwanese Beef Noodle;35;34;Taiwanese, Restaurants;535173522;-1134963954;10336 81 Avenue NW;;restaurants
A76MlGB9LiIa40ZEj3xh4w;Hooters;25;24;Sports Bars, Bars, Restaurants, American (Traditional), Nightlife, Chicken Wings;535369078;-1136273073;9995 178 Street;;restaurants
gw_tsYeTXIN25DqqKb1uPQ;Battista's Calzone;45;85;Italian, Sandwiches, Restaurants;535701913;-113469806;11745 84 Street NW;;restaurants
8otdLbqik8wxeKaL3kcJvg;Shumka Ukrainian Foods;35;18;Ukrainian, Restaurants;535553008;-1134958616;21F Kingsway Garden Mall NW;;restaurants
a5VRcHx0k9TYbHqC1QtjWQ;Famoso Neapolitan Pizzeria;40;50;Restaurants, Pizza;53524408986;-1,13619E+12;1951-8882 170 Street;;restaurants
cxbJ_HMYsFsCvt6hrZvebA;Panciteria De Manila;35;8;Specialty Food, Food, Filipino, Ethnic Food, Restaurants, Breakfast & Brunch;5,35415E+11;-1,13586E+12;15326 Stony Plain Road;;restaurants
gkc4H7_C0nTAiE0veiey2w;CKUA Radio Network;45;8;Mass Media, Arts & Entertainment, Radio Stations;535419598;-1134871294;9804 Jasper Avenue NW;;arts
gwbZhtQiQaS8EPwzpTPnTQ;Columbus Pizza;20;14;Restaurants, Pizza, Food, Donairs, Fast Food;535179142;-1134991839;10443 82 Avenue NW;;restaurants
oWHF9_z9jYPGeN280ahiUg;Leon's Furniture;15;60;Mattresses, Appliances, Furniture Stores, Home & Garden, Shopping;5,36006E+11;-1,13564E+12;13730 140 St NW;;shopping
OuJNtoPL1NLjkgzPM4PcFA;Shenanigans Pub & Grill;35;20;Sports Bars, Pubs, Bars, Arts & Entertainment, Nightlife, Music Venues;535940098;-1133849713;550 Clareview Road, Unit 108;;bars
b-8rRSgneyjgI3StP6YdfA;Gas Pump Night Club & Bar;25;14;Bars, Dance Clubs, Restaurants, Nightlife, Canadian (New);53542095;-113518326;10166 114 Street NW;;restaurants
nXoNoKkkE_T5u4-3XGw3JA;Red Diamond House Restaurant;35;14;Restaurants, Chinese, Buffets;5,35185E+11;-1,13443E+12;7500 82 Avenue NW;;restaurants
DmMYr-qi7XcRzpQMqqktgw;Edmonton Lock & Safe;45;11;Shopping, Safe Stores, Home Services, Keys & Locksmiths, Office Equipment;535086585;-1134972267;7211 104 Street NW;;shopping
BPCauBeb0Gxk_MP3TnJjhA;Towne Pizza;30;9;Event Planning & Services, Food, Restaurants, Pizza, Food Delivery Services, Caterers, Chicken Wings;5,34454E+11;-1,13577E+12;1709 Towne Centre Boulevard NW;;restaurants
3P-Ytd1kmiuOgEiH_60i3A;Sands Inn & Suites;20;14;Event Planning & Services, Hotels & Travel, Restaurants, Bars, Nightlife, Sports Bars, American (Traditional), Hotels;535805429;-1134549621;12340 Fort Road NW;;restaurants
oWtBhwCbdMC5DS2SV5QcWA;Aqua Bistro | Bar;40;9;Restaurants, American (Traditional), Vegetarian, Breakfast & Brunch;53538419;-1136396219;Courtyard Edmonton West, 10011 184th St NW;;restaurants
RzRc0HDJVFSDsem_dp_mjA;The Pint Public House;25;61;Nightlife, Bars, Restaurants, Pubs;535168655;-1134980914;8032 104 Street;;restaurants
IppdfayfahhTBhCt3RID3Q;Panini's Italian Cucina;45;45;Italian, Pizza, Cafes, Restaurants, Gluten-Free;535549478;-1134719284;8544 Jasper Avenue;;restaurants
0Nwx2S36fQGq1MQ-El7ufg;World Waterpark;35;66;Amusement Parks, Active Life, Water Parks, Swimming Pools;5,3522E+11;-1,13626E+12;8882 170 Street NW, Suite 1755;;parks
tVJCBzthLTqe7FlFv6WLAA;Golden Dumpling Restaurant;35;7;Restaurants, Chinese, Noodles, Dumplings;535557124;-113493526;10939-101 Street;;restaurants
1lkQe5amSSOyaIbjgMEc3A;Shambles Gift Shop;30;6;Home & Garden, Shopping, Baby Gear & Furniture, Flowers & Gifts, Home Decor;53542786;-1135382861;12539 102 Ave NW;;shopping
13GtfCKQ-0wN5fmdTPsK_Q;The Videodrome;40;5;Shopping, Books, Mags, Music & Video, Videos & Video Game Rental;53516281;-113493314;8001 102 Street, Suite 8001;;shopping
ULupb87b2qwWMe1EF5Av2w;Cineplex Odeon North Edmonton Cinemas;30;69;Arts & Entertainment, Cinema;535980889;-1135679041;14231 137 Avenue NW;;arts
LdxoPnJ0Lavn0GexsgvDjA;Michaels;35;12;Hobby Shops, Home Decor, Knitting Supplies, Art Supplies, Shopping, Home & Garden, Arts & Crafts;5,35341E+11;-1,13615E+12;9718 170th St Nw;;shopping
v4d_65k_VTQ0nrNy8x2CoQ;Delta Hotels by Marriott Edmonton South Conference Centre;35;22;Venues & Event Spaces, Event Planning & Services, Hotels & Travel, Hotels;5,34816E+11;-1,13493E+12;4404 Gateway Boulevard NW;;hotels
6lwnxitBNMNrB5ZboVBs4g;Colours Art and Framing;40;5;Art Supplies, Framing, Arts & Crafts, Shopping;535111747;-1134946694;10104 149 Street NW;;shopping
15hcLfY9J-4rdTlIkdK0fg;Mikado - Westside;35;67;Japanese, Sushi Bars, Restaurants;53537197;-113617707;9942 170 Street NW;;restaurants
et58P1gZofiFaaAybDyfBw;Treasured Memories;45;6;Shopping, Hobby Shops;534894628;-1134553589;5218 86 St NW;;shopping
DIiLQh5l4gdDCCYxiydFgQ;Yardbird Suite;35;9;Nightlife, Music Venues, Jazz & Blues, Arts & Entertainment;53521526645;-1,13495E+12;11 Tommy Banks Way;;nightlife
cIBRdoAnPHwEzwxlnq495Q;Harvest Room;40;59;American (New), Hotels & Travel, Restaurants, Gluten-Free, Hotels, Event Planning & Services, Steakhouses, Breakfast & Brunch, Canadian (New), American (Traditional);535402604;-1134894945;10065 - 100th Street;;restaurants
