business_id;name;rating;review_count;category;lat;lon;address;phone;category_source
gJkgoklq47r2CZ1zCuRz-A;Pho Rice Pot;30;21;Restaurants, Soup, Thai, Vietnamese;535406505;-1136416376;18485 Stony Plain Road;;restaurants
Gisap06SS9o51ukfnUUVWg;P & L Chinese Restaurant;30;6;Chinese, Restaurants;535455634;-1134784329;9441 Jasper Avenue NW;;restaurants
_qb7Wi3PNYWVph8vAOA2tg;HMV;35;10;Shopping, Music & DVDs, Books, Mags, Music & Video;535433862;-1134930433;Edmonton City Centre, 10088-102 Ave;;shopping
rnrhKo_ooVQ1DdgRzBpQMg;Smitty's Family Restaurant;25;9;Breakfast & Brunch, Restaurants;5,35977E+11;-1,13491E+12;1028, 9499 - 137 Ave;;restaurants
dkM_mhcsQ8ZXketVUG_AWw;Peoples Jewellers;20;7;Watches, Jewelry, Shopping;5,35629E+11;-1,13505E+12;109 Princess Elizabeth Avenue NW;;shopping
RSx3e6HDWjsuTayWLA-Z4A;Sears;20;5;Fashion, Shopping, Department Stores;5,34864E+11;-1,13513E+12;5015 111 Street NW;;shopping
wwsampv9tJYTxajS2B78fQ;Groove Stone;40;10;Accessories, Jewelry, Shopping, Fashion, Women's Clothing;5,3485E+11;-1,13514E+11;5015 111 Street;;shopping
LeeTBrPv9C_piRZC1Q_Qsg;Campus Pizza;40;17;Donairs, Food, Pizza, Restaurants, Food Delivery Services;53512629;-113520096;7610-112 Street;;restaurants
pvC022Q2HIsSg0dNksS7bQ;Tra Amici Cafe & Bar;35;6;Food, Restaurants, Italian, Coffee & Tea;535122523;-1135208694;11212 76 Avenue NW;;restaurants
Mh_icXCeZwvM2iELX7p9gQ;Costco;35;39;Shopping, Wholesale Stores;535790106;-1135799217;12450 149 Street NW;;shopping
Hjm3aL72Y_8JRoV0hrMR1Q;Koultures;35;8;Middle Eastern, African, Ethiopian, Restaurants, Bars, Nightlife;53570235;-11347702;8803 118 Avenue NW;;restaurants
kdhcA1SXMT0YaKioEhepsw;Wendy's;30;6;Restaurants, Burgers, Fast Food;534593433;-113432327;6510 - 28th Avenue;;restaurants
FYZESlQkGYRNa_UNaWTnsA;IHOP;25;42;Food, Restaurants, Ice Cream & Frozen Yogurt, Breakfast & Brunch, American (Traditional);53614576;-113541854;15130 127th St, Oxford Landing Center, Oxford Landing Center;;restaurants
eICTTr9-UKwusB3f4QVQjw;Edo Japan;45;9;Sushi Bars, Japanese, Restaurants;535350377;-1136156024;170 Street, Suite 9794;;restaurants
SVAsvMbctwumzI4qRmZoGA;Baek Jeong Korean BBQ house;40;22;Korean, Restaurants, Barbeque;534586493;-113493353;2874 Calgary Trail NW;;restaurants
gGV8GLMIikXGegF0NWS6Pg;YEG Bakers;25;7;Restaurants, Custom Cakes, Bakeries, Food, Cafes;5,34548E+11;-1,13428E+12;270-2331 66 Street NW;;restaurants
3wLmMcYDXWkiAjLCFAxg3w;Pho Huong & Mama Pizza;40;31;Pizza, Restaurants, Vietnamese, Steakhouses;535510949;-113502389;10531 107 Avenue NW;;restaurants
kkR4hXKGY2WgU52osjIqyw;Funky Buddha;30;17;Pubs, Bars, Nightlife;535178702;-1134965292;10341 82 Ave NW;;bars
J6KMedR-L-tP4wKIAsj7tw;Ricky's All Day Grill;25;23;Restaurants, Canadian (New), American (New);5,35412E+11;-1,1351E+12;10140 109 Street NW;;restaurants
8PBAp266ImQHEiWYUXOaSQ;Sofa Land;40;11;Home & Garden, Furniture Stores, Shopping, Home Decor;535896297;-1135655061;13030 Street Albert Trail NW;;shopping
atyWcLm7m5Zvu30xi0wr6w;Metro Cinema at the Garneau Theatre;45;66;Arts & Entertainment, Cinema;535237941;-1135121585;8712 109 Street;;arts
UmtLwHKvTYgmw5GR_aqeSg;ETS Edmonton Transit System;20;55;Public Services & Government, Public Transportation, Hotels & Travel, Transportation;535713987;-1135889412;11904 154 St NW;;hotels
2POgnNz3br94YBco7z1UwA;Red Swan Pizza;45;8;Pizza, Restaurants;5,35201E+11;-1,13487E+12;10046 82 Avenue NW;;restaurants
QBYxe4jNLpWX37GwnrFrHQ;Denny's;30;8;Breakfast & Brunch, Restaurants, American (Traditional), Diners;534238139;-1134902543;10111 Ellerslie Road;;restaurants
nIYh3XMvNEKiCe5KEgAiXg;Royal Glenora Club;40;12;Restaurants, Event Planning & Services, Active Life, Fitness & Instruction, Venues & Event Spaces;5,35329E+11;-1,13515E+12;11160 River Valley Road NW;;restaurants
3hG375YzIhZg2EYA-TOyhw;Edmonton Eskimo Football Club;45;9;Active Life, Arts & Entertainment, Sports Clubs, Professional Sports Teams;535609216;-11348016;11000 Stadium Road NW;;arts
xPmbr4S0_XYweiNmga9dNA;Bird's Nest of Beijing Restaurant;20;9;Restaurants, Chinese;53538694;-1135007749;10425 100 Ave NW, Comfort Inn & Suites;;restaurants
lw7b0XUWNJqunBSoMU3VBQ;Supply Sergeant;30;8;Outdoor Gear, Shopping, Sporting Goods;53522840282;-1,13622E+12;West Edmonton Mall, 8882 170 Street NW, Suite 1434;;shopping
2whW4Ko3ZvtPtLvlrSDsSg;Apple Box Boutique;40;8;Home Decor, Furniture Stores, Shopping, Home & Garden;535646574;-1134379964;6507 112 Avenue;;shopping
73uFR4QuDuH9VD1oehtOQQ;Summerside Pizza and Donair;25;12;Pizza, Restaurants, Indian, Donairs, Food;534298226;-1134787805;2956 Ellwood Drive SW, Unit 15;;restaurants
mY7DKQ6qQYr_V21TWmspOA;Milestones Restaurants;30;78;American (New), Restaurants, Bars, Canadian (New), Nightlife, Comfort Food;534457818;-1134855743;1708-99th Street NW;;restaurants
ZMpWEiS87yP6bNZKdagXBQ;Chopsticks Diner;40;19;Diners, Restaurants;5,35028E+11;-1,13628E+12;6655 178 Street NW, Suite 514;;restaurants
Me0-sq4I3CPPkwnzRPdK-w;Dairy Queen Grill & Chill;20;15;Ice Cream & Frozen Yogurt, Fast Food, Food, Restaurants;534533698;-1,13425E+11;5403 - 23rd Ave;;restaurants
2Qu4KuvENDCNahykyQjgHA;Chatters Hair Salon;30;28;Cosmetics & Beauty Supply, Nail Salons, Hair Salons, Shopping, Beauty & Spas;53478972;-11337317;1942 38 Avenue NW;;shopping
xmbX-1qkUvxOxzrvrE5fFQ;SEPHORA;30;10;Beauty & Spas, Cosmetics & Beauty Supply, Nail Salons, Shopping;53485157;-113513676;5015- 111 Street NW, Unit 29;;shopping
sFKdOewHAcVJwt8hhF_reA;Curry Corner;45;38;Indian, Buffets, Restaurants;53468271926;-1,13587E+12;616 Riverbend Square NW;;restaurants
y6HvbaoglrJilu1D28ADVw;Special Event Rentals - Edmonton;45;10;Party Supplies, Party Equipment Rentals, Shopping, Wedding Planning, Party & Event Planning, Event Planning & Services;534960849;-1134866322;6010 99 Street NW;;shopping
hRMKcIPO5WoZBtYTtSZCYQ;Pizza Hut;25;9;Restaurants, Pizza, Italian, Chicken Wings, Food Delivery Services, Food;5,34766E+11;-1,13418E+12;4020-50th St NW;;restaurants
jouV5hLghdm-WVw4Hgr3qQ;John Fluevog Shoes;45;8;Fashion, Shoe Stores, Leather Goods, Accessories, Shopping;53518458;-113496196;10330 82 Avenue NW;;shopping
TAitPmhWLhTSLmeJQ85iog;Pablo Cheese Tart;35;11;Restaurants, Cafes, Bakeries, Desserts, Food;5,35169E+11;-1,13493E+12;10163 81 Avenue NW;;restaurants
W63pyFSFRyteq4Z5izi3Ng;Captain Scott's Fish & Chips;40;17;Fish & Chips, Seafood, Restaurants;535706989;-1135515807;13240 118 Avenue NW;;restaurants
kiLDPsEz01tlE4UlrD3Y1A;L1 Lounge;25;12;Lounges, Nightlife, Bars;535222626;-1136280448;17700-87 Avenue;;bars
RSJEED36KqLdmPUo7td6Sw;Urban Tavern;40;39;Nightlife, Pubs, Wine Bars, Dance Clubs, Beer, Wine & Spirits, Restaurants, Bars, Food;5,35412E+11;-1,13522E+12;11606 Jasper Avenue;;restaurants
ry5P9QjbU6hKNBLm4JuAyw;Tai Wa Watch & Clock Company;45;9;Shopping, Watches, Local Services, Watch Repair;535491597;-1134886588;9700 105 Avenue NW 122, Suite 122;;shopping
Wz7Zmqfl2VaJi_aacanbZw;Petals On The Trail;35;12;Gift Shops, Shopping, Local Flavor, Flowers & Gifts, Florists, Arts & Crafts;535849301;-1135413637;12720 127 Street;;shopping
k5FAHemD_mUy4YK4NCsJgA;Thai Valley Grill;35;24;Thai, Restaurants;53479609734;-1,13502E+12;4211 106 Street NW, Unit 149;;restaurants
_DnAn3D-USQ8cL1WXUiG_Q;Dollarama;35;10;Fashion, Discount Store, Shopping, Department Stores, Outlet Stores;5,35154E+11;-1,13499E+12;10455 80 Avenue NW;;shopping
KbvW90THoQ7uvgn9mlAYhA;Niche;40;33;American (New), Canadian (New), Restaurants;53540794;-1135110352;11011 Jasper Avenue;;restaurants
jEvoDXtF3xMJsiPPbqGSmw;Tres Carnales Taqueria;40;429;Restaurants, Mexican;535414338;-1134918157;10119 100A St;;restaurants
dNRnjV2oQJgQSW9GbD_how;Merle Norman;25;8;Cosmetics & Beauty Supply, Shopping, Beauty & Spas, Nail Salons, Skin Care;53522232388;-1,13619E+12;8882 170 Street, Unit 2093, West Edmonton Mall;;shopping
SPfhB2HCUF70gBUZOL4o7A;RW&CO;30;12;Women's Clothing, Men's Clothing, Shopping, Fashion, Accessories;53485051;-11351517;5015 111 Street NW;;shopping
32U4F9x3THgJ7r9836duhQ;Hot Wok;35;11;Restaurants, Chinese;535405989;-1135943327;10050 158 Street NW;;restaurants
t-lXYyxJKSlbP9l_6mqHjw;Freshii;45;5;Caterers, Soup, Specialty Food, Health Markets, Breakfast & Brunch, Food, Event Planning & Services, Salad, Vegetarian, Restaurants, Juice Bars & Smoothies, Fast Food;5,34786E+11;-1,13371E+12;3924 17th St NW;;restaurants
sS6ieYC8yCg3HQdA64Pi8w;Bissell Centre's Thrift Shoppe;40;5;Shopping, Thrift Stores;5,35707E+11;-1,13477E+12;8818 118 Avenue NW;;shopping
YQ5JtyN17HiblFCzeBIwrg;Queen Donair;35;21;Food, Fast Food, Burgers, Donairs, Restaurants, Pizza;53541069;-1135907665;10068 - 156 Street;;restaurants
PHb7D2ggdPi0CpxJ431ryQ;WestWorld Computers;35;22;IT Services & Computer Repair, Local Services, Computers, Shopping;5,35444E+11;-1,13615E+12;10333 170th Street;;shopping
0j1dLO027zRb54xfAKO0vQ;Top Shots Billiards and Ping Pong;35;9;Nightlife, Sports Bars, Restaurants, Bars, Pool Halls;534568384;-113433425;2621 66 street;;restaurants
9fTh1-hoYmbonkfpk_2VyQ;Taco Del Mar;30;14;Restaurants, Fast Food, Tex-Mex, Mexican;534553868;-1135648358;2305 Rabbit Hill Rd NW;;restaurants
neCEdT3uI1265OBaY6r8Vg;Filistix;45;6;Filipino, Restaurants;53525262;-1135271987;8900 114 Street, University of Alberta;;restaurants
QUQQmzDGpbw6ZTqZwpcM8Q;OPA! of Greece;40;7;Greek, Sandwiches, Fast Food, Restaurants;5,35438E+11;-1,13493E+12;10205 - 102A Avenue NW;;restaurants
RBttSgPzMzzX0FF5iozVIA;Rice Bowl Express;45;7;Japanese, Vietnamese, Korean, Chinese, Restaurants, Asian Fusion;535219849;-1135783339;8926 149th St;;restaurants
To-Q61QhwvF-sxKHA2UXBw;Franco's Pizza & Steak House;30;30;Steakhouses, Italian, Pizza, Restaurants;535888976;-1134175578;12881 50 St;;restaurants
KM2gV12GRea62fKTyjJydQ;The Tin Box;40;12;Shopping, Home Decor, Home & Garden, Fashion, Accessories, Flowers & Gifts;53518235;-1135009342;10508 82 Ave NW;;shopping
jd7H0caXBI8Fv1Gq-oI8bA;Sawmill Prime Rib & Steakhouse;25;68;Salad, Buffets, Steakhouses, Restaurants;5,35324E+11;-1,13616E+12;9504 170th Street NW;;restaurants
VHjsCzSCNPwtVYKHK86Q8w;The Lobby;45;7;Cinema, Arts & Entertainment, Videos & Video Game Rental, Books, Mags, Music & Video, Shopping;535176712;-1135101723;10815 82 Avenue NW;;shopping
Ikp52qJeaSZ2rDIEX7_JoQ;Dairy Queen Grill & Chill;25;6;Food, Fast Food, Restaurants, Ice Cream & Frozen Yogurt;5,34943E+11;-1,13666E+12;6214 199th St NW;;restaurants
p22ftAnWeBdwpD-to-Jgzg;Dollarama;30;7;Discount Store, Shopping;5,35602E+11;-1,13552E+12;111 Westmount Center NW, Unit 400;;shopping
QUGzvwV-qYSQ4-JlKHq57Q;Pier 1;25;5;Shopping, Home & Garden, Candle Stores, Furniture Stores, Home Decor;5,36007E+11;-1,13554E+12;13530 137th Avenue NW;;shopping
sQWe9s0LgpIAZlGZDIFcKg;The Kitchen Restaurant;35;27;Breakfast & Brunch, Seafood, Buffets, Cafes, Restaurants;53509616;-11369729;300 Chief Lapotac Blvd NW;;restaurants
HdTGEuChp8bqRMUjnkqgFA;Kathmandu Rasoi;50;15;Restaurants, Himalayan/Nepalese, Chinese, Hakka, Indian;53533699;-113628146;17759 98A Avenue NW;;restaurants
fxHLVPElW6QxlJIf-NWEHA;Divine;35;9;Women's Clothing, Tattoo, Fashion, Beauty & Spas, Shopping, Men's Clothing, Used, Vintage & Consignment, Piercing;535180502;-1134994662;10441 82 Ave NW;;shopping
rH_4rmLjL2y8qh7r2AOXNQ;La Senza;40;5;Lingerie, Fashion, Shopping;535224163;-1136254541;8882 170 Street NW, Unit H105;;shopping
nirGUDMerC3EIrkCxf9JkQ;A&W;30;6;Burgers, Restaurants, Fast Food;535412364;-1134165315;4940 101 Avenue NW;;restaurants
AWG2QYOoydgg2hMMk3KRoA;The Home Depot;20;5;Home & Garden, Fashion, Shopping, Department Stores;5,34389E+11;-1,13607E+11;Terwillegar Drive NW;;shopping
Bj57Mew7cMVvkeWpgbNgeQ;Capilano Mall;20;9;Shopping Centers, Shopping;5,35395E+11;-1,13422E+12;5004 98 Avenue NW, Suite 203;;shopping
fWFgBbevUJE6MeuDZdA9Cw;Dollar Tree;40;5;Shopping, Discount Store;535411556;-1135811198;15061 Stony Plain Road NW;;shopping
EkPllamJ0ox69OEDLNMQNA;Alberta Cycle Motorsports;25;7;Motorcycle Dealers, Shopping, Automotive;535818417;-1134909948;12505 97 Street NW;;shopping
Y2WtKgGT_ZS4VJxnZ0X47Q;Zara;25;14;Men's Clothing, Women's Clothing, Shopping, Fashion, Children's Clothing;5,35223E+11;-1,13623E+12;8882 170 Street;;shopping
NFXvrdA_TUepcGAsHzjbgQ;Tim Hortons;25;9;Restaurants, Delis, Sandwiches;535611396;-1135522215;11240 Groat Road NW;;restaurants
9ARtxpInAHsAMQpyMlckFw;V Sandwiches;45;15;Restaurants, Sandwiches, Vietnamese;53541933;-113492241;10135 100A Street;;restaurants
ZwP94ZmUx7J8xMJZBp2ZWg;Richard's on 50th;30;5;Restaurants;535914161;-1134179484;13020-50 St;;restaurants
NUVPGowRmfN1NkecJB6R2Q;Doan's Vietnamese Restaurant;35;58;Restaurants, Vietnamese;5,3515E+11;-1,13496E+12;7909 104 Street NW;;restaurants
uRRFptfpv1blUDkxDcsQEA;Edmonton Event Centre;20;13;Nightlife, Music Venues, Arts & Entertainment;535221057;-1136234969;170 Street NW, Suite 8882;;nightlife
H__s8RupBhI2F7A2jr0sOw;Pagolac Restaurant;40;53;Chinese, Restaurants, Vietnamese;535093802;-1134392337;7137 Argyll Rd NW;;restaurants
pBKO-eMXA7x1zOqyYEPMVg;Subway;25;5;Restaurants, Sandwiches, Fast Food;534534923;-1135093068;Heritage Links, 101, 10903 23rd Ave;;restaurants
eY0ixk_DITr1R53HtCIokA;Tony Roma's;25;41;American (Traditional), Steakhouses, Restaurants, Barbeque, Seafood;53523166;-113624156;1640 Bourbon Street;;restaurants
-DlF6neBa1HKx7aFi3ZxOg;Reinette Cafe & Patisserie;45;44;Coffee & Tea, Cafes, Restaurants, Food, Desserts;5,34677E+11;-1,13431E+12;301 Woodvale Road W;;restaurants
NJ9Qe-Ba1Pzf7ALbBl182g;Famoso Neapolitan Pizza;40;26;Pizza, Restaurants, Italian;5,3453E+11;-1,13563E+12;14123 23 Avenue NW;;restaurants
6JBJTohCP_ixC-8vd4B_Gg;Island Cafe and Bistro;45;55;Vegan, Thai, Food, Singaporean, Desserts, Creperies, Coffee & Tea, Malaysian, Chinese, Asian Fusion, Restaurants, Bistros;535379444;-1136140229;9923 - 170 Street;;restaurants
7HWyNJE9FtY85mIfw0-wUA;Diva Hair Superstore;25;8;Shopping, Cosmetics & Beauty Supply, Beauty & Spas;53550469;-113536044;124 Street NW, Unit 10625;;shopping
x3LgJHNNPGNH81hKl_WzGg;Soho;45;8;Bars, Pubs, Restaurants, Pizza, Nightlife;535413267;-1135188087;11454 Jasper Avenue NW;;restaurants
sObr37op3k51WFriY2zbkA;Block 1912;35;171;Ice Cream & Frozen Yogurt, Desserts, Restaurants, Specialty Food, Ethnic Food, Coffee & Tea, Bakeries, Food;53517844;-113497128;10361 82 Avenue NW;;restaurants
cu8CKbr5CHvbrScrwVMv0w;Spice Centre;45;6;Shopping, Imported Food, Food, Ethnic Food, Herbs & Spices, Music & DVDs, Grocery, Books, Mags, Music & Video, Specialty Food;534661923;-1134730798;9280 34th Avenue NW;;shopping
dLVXcceTQlOYJRz9N4M0xg;Bodega Tapas and Wine Bar;40;34;Nightlife, Tapas Bars, Spanish, Restaurants, Bars, Wine Bars, Portuguese;535430823;-1134974613;10220 103 Street, Suite 109;;restaurants
EbBing7Y8Y0rjGVfbt9h7Q;Casablanca;25;11;Restaurants, Desserts, Juice Bars & Smoothies, Hookah Bars, Mediterranean, Food, Bars, Cafes, Nightlife;53518250863;-1,13509E+12;10762 82nd Ave NW;;restaurants
KEqxLIBsy-2TxyZSDKHUpw;GF Diner;40;14;Restaurants, Food, Breakfast & Brunch, Gluten-Free, Specialty Food;5,3518E+11;-1,1349E+12;10015 82 Avenue;;restaurants
PmWMX-uVYrP3IPByH9MXxg;Yellow Cab;20;71;Hotels & Travel, Transportation, Taxis;534625167;-1134898001;10135 31 Avenue NW;;hotels
F-ulZH0KUBEk5WVJ2o3vVw;Decadence;35;13;Used, Vintage & Consignment, Women's Clothing, Fashion, Shopping, Thrift Stores;535182412;-1135087302;10760 82 Avenue NW;;shopping
anQY6hXRuKUx2JiNdGshdA;Boston Pizza;35;19;Pizza, Restaurants, Italian;535624013;-1135519684;11320 Groat Road NW;;restaurants
Me_7NMi17Bj5t_ycPqPN7g;Tutti Fruiti;35;7;Salad, Burgers, Restaurants, Breakfast & Brunch;534529738;-1135105629;10923 23 Avenue;;restaurants
g-Q7m7G3Xrez_Vc2T4wqNQ;Namaste India;50;6;Gluten-Free, Vegan, Restaurants, Indian;53607487;-1134589011;7626 144th Avenue Nw;;restaurants
EFrKfQ9bZHRIDuENJxFoLQ;Monster Mini Golf Edmonton;45;18;Arts & Entertainment, Arcades, Laser Tag, Golf, Mini Golf, Party & Event Planning, Active Life, Venues & Event Spaces, Event Planning & Services, Kids Activities;53469010452;-1,13493E+12;301 - 3414 Gateway Boulevard;;arts
P_3O2IwVCvrL5VI5ZTktzw;Blogger Armoire;30;8;Fashion, Shopping, Used, Vintage & Consignment, Women's Clothing;535385727;-1135207964;11523 100 Avenue NW, Suite 102;;shopping
sR_zDvLVHZFtNPsG7vgGfw;1ST RND;35;70;Burgers, Sports Bars, Fast Food, Nightlife, American (Traditional), Bars, Restaurants;535230594;-1136260109;8882 170 Street NW, Suite 1672;;restaurants
kOeRH3gcFozM-h8M4grbYA;Prime Time Donair & Poutine;30;6;Food, Donairs, Portuguese, Restaurants;5,34078E+11;-1,13538E+12;2779 119A Street SW;;restaurants
tSKcrTB3F0ZZv-eSR0d34Q;Sai Woo Garden Restaurant;40;45;Restaurants, Chinese;53549971;-113488382;10571 97 St NW;;restaurants
vsRHKHe7kKEU0n1uWlGhtw;David Morris Fine Cars;20;5;Car Dealers, Breakfast & Brunch, Restaurants, Auto Parts & Supplies, Auto Detailing, Automotive;535591409;-113621998;17407 111 Avenue NW;;restaurants
gH3fKYUCsjIrIvGgXzXdfA;Caffe Sorrentino;40;6;Italian, Restaurants, Cafes, Coffee & Tea, Food;535404958;-1135083713;10051 109 Street NW;;restaurants
L5Hdck6IhHmryDdRRv8U_g;Red Lobster;25;75;American (Traditional), Barbeque, Canadian (New), Restaurants, Seafood, American (New);53477512;-113494851;4111 Calgary Trail South;;restaurants
1YCSqrenYs6j7ZD373lYaA;Deadmonton Haunted House;50;33;Haunted Houses, Arts & Entertainment, Tours, Performing Arts, Hotels & Travel, Walking Tours;535068854;-1134940296;7031 Gateway Boulevard;;hotels
a_xjGpKLYFuJYUB91elRaw;Game City;30;8;Videos & Video Game Rental, Shopping, Video Game Stores, Hobby Shops, Books, Mags, Music & Video, Electronics;53455307762;-1,1343E+12;Millwoods Town Center, 2331 66 Street NW;;shopping
scnoLACS2mcD_VsPTMOlAA;Nongbu Korean Eatery;45;48;Restaurants, Korean;535174639;-113497275;8115-104 Street NW;;restaurants
B6ZII96eauJboG-6Tty7IQ;Dairy Queen;35;9;Restaurants, Fast Food, Food, Ice Cream & Frozen Yogurt;535396766;-1135909619;10018 156th St;;restaurants
-2oyyfOSHs1UElr3Dc1aKQ;Highlands Kitchen;40;12;Ukrainian, Restaurants, Canadian (New), Comfort Food;535646777;-1134381547;6509 112th Avenue;;restaurants
X-M5wlsc0XzrNgbuEguK1A;Smitty's;25;12;Diners, Restaurants, Breakfast & Brunch;536002039;-1134208888;400 Manning Crossing;;restaurants
0Mnb5KLigKua42lAo5C0Vg;Memphis Blues Barbeque House;30;50;Restaurants, Nightlife, Barbeque, Whiskey Bars, Bars;53630590071;-1,13538E+12;16907 127 Street;;restaurants
DPaLbl5g6pM2O9l1ivzXbQ;Wendy's;10;9;Burgers, Restaurants, Fast Food;535094319;-1134424432;7410 Argyll Rd.;;restaurants
gBeQgtr7grReo7Q2yojDVA;O'Byrne's Irish Pub;35;83;Bars, Nightlife, Pubs;5,35182E+11;-1,13504E+12;10616 82 Avenue NW;;bars
OJtBiSvJxLRmpvXFauwtbg;Maurya Palace Restaurant;40;15;Restaurants, Pakistani, Indian, Buffets;536029737;-1133850416;14041 Victoria Trl NW;;restaurants
LTxiMC1mjAeoPWjgsV928Q;Beauty Junkie;40;5;Cosmetics & Beauty Supply, Beauty & Spas, Shopping;53523833;-1136165014;8882 170 Street Northwest;;shopping
fMfHMH-8-uv0boVFlwjk-w;Jumbo Donair;50;32;Donairs, Sandwiches, Restaurants, Mediterranean, Fast Food, Food;5348111;-113444268;4220 66th Street NW;;restaurants
h_Ql7mHRlio1ChmzthcGZQ;Sakana;35;31;Restaurants, Japanese;5351547;-113497986;7908 104 St NW;;restaurants
1zqsGhxOCs4rtGasfBUbuA;Harvey's;40;7;Burgers, Restaurants, Fast Food, American (Traditional);534680923;-1134951244;10350 34 Avenue NW;;restaurants
pTfvyTYekF9o23WYj1Sn1g;The Citadel Theatre;45;34;Arts & Entertainment, Performing Arts;535429893;-1134879924;9828 101A Avenue NW;;arts
LoxaLZyS7WfY0l2odvwfFQ;Mr Sub;35;5;Restaurants;536000762;-1135502086;13256 137 Avenue NW;;restaurants
aAeNwCZ9WnsWfXWGJ3eUbA;BlackBall;35;9;Desserts, Food, Taiwanese, Restaurants;535420249;-1136189844;17288 Stony Plain Road;;restaurants
uBu05_Pko4eTh5kty6-ZNA;Butterdome Christmas Craft Sale;40;6;Arts & Crafts, Flowers & Gifts, Shopping;53523024566;-1,13526E+12;87 Avenue and 114 Street;;shopping
TnE88JiuC6mzeejgl7yjnA;Fionn MacCool's Irish Pub;25;35;Bars, Pubs, Food, Restaurants, Nightlife, Gastropubs, Irish, Beer, Wine & Spirits;5,34814E+11;-1,13491E+12;4485 Gateway Blvd;;restaurants
heP3GV3SpXDVy96vX6Yt1Q;River City Yarns;40;8;Shopping, Arts & Crafts, Knitting Supplies;5,35603E+11;-1,13614E+11;16956 111 Avenue;;shopping
Hq_EvRajv9vQMn-A-rZ1eQ;No Excuses;30;5;Cosmetics & Beauty Supply, Shopping, Beauty & Spas;535225151;-1136241906;West Edmonton Mall, 1097-8882 170 Street Nw;;shopping
00ZHPWYGtJTY8zqfTfP_2Q;The Burg;30;121;Burgers, Restaurants;5,35429E+11;-1,135E+12;10190 104 Street NW;;restaurants
uwtZHsvaENUXhUD--_JU2A;Tim Hortons;30;13;Delis, Restaurants, Coffee & Tea, Sandwiches, Food;5,35407E+11;-1,13644E+11;18531 Stony Plain Road NW;;restaurants
B9nlnMHcr2EDc_9Q_rPawA;Carl's Jr;35;11;Restaurants, Burgers, Fast Food;53475699904;-1,13368E+12;3791 17 Street;;restaurants
2drLRcRuqVJEksQXV0ynjQ;Syphay Restaurant;45;73;Restaurants, Thai, Laotian;534973596;-1134980091;6010 104 Street NW;;restaurants
ONOxPZyqRyBYNnjq6VFHZQ;Roxx;40;9;Hobby Shops, Gemstones & Minerals, Home Decor, Jewelry, Shopping, Home & Garden;535200556;-1134552108;145-1 Bonnie Doon Shopping Centre Nw;;shopping
0z6gFGDSeb59ZkoSoO7LdQ;Otto Food and Drink;45;63;Restaurants, Gastropubs;535644996;-1134869714;11405 95 Street NW;;restaurants
3LYlSKcml4fb4bmwztEN6g;The Twisted Fork Diner;25;7;Street Vendors, Restaurants, Food, Bars, Sports Bars, Nightlife, American (New);535181978;-1135199431;11162 82 Ave;;restaurants
pCQwiWrZR1_oMxJikUYQyg;Oodle Noodle;30;55;Restaurants, Chinese, Food, Noodles;5,35178E+11;-1,13509E+11;10842 Jasper Avenue;;restaurants
0QaTcaoXrjCWLKreDQs9fA;Comic King;25;10;Books, Mags, Music & Video, Comic Books, Hobby Shops, Shopping;5352252;-113624195;West Edmonton Mall, 170 Street NW;;shopping
ZSh2zcBZfp7o9llcFQCdwQ;Restaurant Yarrow;50;8;Restaurants, Bars, Tapas/Small Plates, Wine Bars, Canadian (New), Nightlife;53548848;-113517936;101-10544 114 Street NW;;restaurants
OosZSay0ewJacP8nxbU5ZQ;Legend Automotive Repair;50;6;Battery Stores, Automotive, Tires, Shopping, Auto Repair, Transmission Repair;53537911;-113437376;7110 98 Avenue NW;;shopping
GlMO3KCXf8YdrQAGd5rkiQ;Comfort Inn & Suites;30;8;Hotels & Travel, Event Planning & Services, Hotels;53538694;-1135007749;10425 100th Ave;;hotels
XSkNvcMvvPxyro1vI1nWuA;City Appliance;20;11;Home Services, Appliances, Shopping, Local Services, Appliances & Repair, Home & Garden;53482855;-113415474;1075 James Crescent NW;;shopping
nzmOsV_uQ8jOrEurvhvxEQ;Coco Deep Fried Chicken;40;10;Korean, Restaurants, Chicken Shop;53511631616;-1,13679E+12;3030 Granville Drive NW;;restaurants
qmSHSilmMX2EeOW3cEaY9Q;The Rice Pad;30;11;Vegetarian, Restaurants, Vietnamese;5362651;-1134901114;9616 165 Avenue NW;;restaurants
01pmVUeVeXKtxdnLcQrUOg;The Black Bull Kitchen & Bar;40;27;Restaurants, Canadian (New), American (New), Pizza;53556481;-113607191;16642 109 Avenue NW;;restaurants
Tlx0CVjND3ytUg-ti_Jakw;A&W;10;5;Restaurants, Fast Food, Burgers;535959674;-113492507;13440 97th Street;;restaurants
9SD6KVk2EpgQaCeCrd3-UA;Sneak Preview;40;6;Arts & Entertainment, Videos & Video Game Rental, Shopping, Books, Mags, Music & Video;534758735;-1135048572;4047 106 Street NW;;shopping
t8C6lgu8dCbcjJ700W2Tsw;Urban Barn;45;6;Home Services, Lighting Fixtures & Equipment, Furniture Stores, Home Decor, Rugs, Home & Garden, Shopping;536006703;-113557017;13620 137 Avenue NW;;shopping
603TuZmMQfj1PQ2wd_Zp5A;All Hours Pizza & Donair;20;36;Pizza, Restaurants, Food, Donairs;5,35877E+11;-1,13528E+12;11922 129th Avenue NW;;restaurants
bARvQz02raTnHmfhtdu3-A;Best Buy;30;22;Computers, Local Services, IT Services & Computer Repair, Electronics, Shopping;5,35406E+11;-1,13625E+12;17539 Stony Plain Rd. NW;;shopping
Ad5RI08VAe3Kp9mBkppHBQ;Best Western Plus Westwood Inn;20;10;Hotels & Travel, Hotels, Event Planning & Services;5,35404E+11;-1,13634E+12;18035 Stony Plain Road;;hotels
cr37fhoX14AcdgFK5nl7wg;Reside Furnishings;45;6;Furniture Stores, Fashion, Home & Garden, Shopping;535473353;-1136134589;10434 Mayfield Road NW;;shopping
VEVb6fbs9RCw4Symuz3fPg;Empire Theatres City Centre 9 Cinemas;35;33;Arts & Entertainment, Cinema;535432787;-1134943022;Empire Theatres, 10200 102 Ave;;arts
h0IEDvVAqFIBHY9Nhni5qQ;Canadian Tire;20;12;Automotive, Department Stores, Tires, Shopping, Home & Garden, Gas Stations, Fashion;5,35387E+11;-1,13417E+12;9847 - 50th Street NW;;shopping
Ch9GzsRI1gLCIfg6drnd6w;Coriander Cuisine;50;13;Restaurants, Indian;535124416;-1135207091;11214 76 Avenue NW;;restaurants
QUTLYamq5psXeR8NSv4yzQ;Ha Phuong's Vietnamese Restaurant;40;5;Restaurants, Vietnamese;535529365;-1134891863;9656 107A Avenue;;restaurants
CrqXtKqLFfivX66qrIRK5g;Maxwell Clothiers;15;6;Shopping, Fashion, Men's Clothing;535474762;-1135337802;10441 123 St NW;;shopping
WNcibuID0lywpN2bWukTug;Wedding World;25;5;Bridal, Shopping;53491478;-1134907;5361 Gateway Boulevard;;shopping
Ay45T3uOSEyo2RmT5zS9_w;City Hall;40;12;Public Services & Government, Landmarks & Historical Buildings;5,35457E+11;-1,1349E+12;1 Sir Winston Churchill Square;;landmarks
E1avnPykToD3jxSu877P3g;Smilie's Place;15;15;Restaurants, Chinese;535899659;-113467865;13022B 82 Street NW;;restaurants
eHC82PofK3RKYrbXcIY0xw;Boston Pizza;25;22;Restaurants, Pizza, Italian;534549473;-1134230456;5228 23rd Ave NW;;restaurants
1Nvx5xo_cErlEqpubzocSg;Denny's;30;12;Restaurants, American (Traditional), Breakfast & Brunch, Cafes, Diners;5,35711E+11;-1,13614E+12;16806 118 Avenue;;restaurants
0dIlxPUw9JXFwVbabWxRvQ;Hong Kong Bakery;35;11;Bakeries, Food, Chinese, Restaurants;535513626;-1134890435;10649 97 Street NW;;restaurants
wdJiF4lIM8Toz-wbYaMLdA;Atlas Steak + Fish;40;60;Cocktail Bars, Bars, Restaurants, Seafood, Steakhouses, Nightlife;5,35464E+11;-1,13496E+12;10204 104 Avenue NW;;restaurants
VdCIcyn_s63Pxo916vkGvg;MLT;25;38;Restaurants, Vietnamese;534686324;-113488028;3438 99 Street NW;;restaurants
uXVs9d3WmdAAKlv9otpRaw;Brewsters Brewing Company & Restaurant;35;89;Food, Restaurants, American (New), Canadian (New), Bars, Brewpubs, Sports Bars, Beer Bar, Nightlife, Breweries;535470166;-1135217839;11620 104th Avenue NW;;restaurants
